Id,Label,description,attr_home,Decodex,Fiabilité,Catégorie,Orientation contenu,Synthèse,Fiabilité et orientation
202d28e7-9f29-43b4-b781-52d53a16ea2a,Ohmymag,"Un site qui se présente comme un « média social féminin » édité par le groupe Cerise, racheté par le groupe Prisma Media en 2016. Il revendique faire de « l'infotainement », forme de traitement de l'information par le divertissement, et pas de l'actualité à proprement parler.  Il diffuse des informations sous un angle parfois racoleur, avec des titres sensationnalistes voire trompeurs.",http://ohmymag.com,4,Plutôt fiable,Média français,Autre ou non déterminé,Média français plutôt fiable,Plutôt fiable
468558db-e688-4a02-ba19-a892fc1ff4c1,OJIM,"Un site qui se présente comme un observatoire des médias. Il est en fait tenu par deux figures de l'extrême droite et publie des portraits virulents et souvent mensongers de journalistes, sans jamais les contacter.",http://ojim.fr,3,Douteux,Autre ou non déterminé,Extrême-droite,"Site peu fiable ou douteux de droite, d’extrême droite ou pro-russe",Douteux
41370603-bf47-45be-8b17-291544940d5f,Onze mondial,Un magazine mensuel consacré au football.,http://onzemondial.com,4,Plutôt fiable,Média français,Autre ou non déterminé,Média français plutôt fiable,Plutôt fiable
54c8d62d-eab6-42b4-a167-ba03da9832d7,Ooreka,"Un site internet du groupe Fine Media, acquis par le groupe Pages Jaunes en 2011, qui relaie régulièrement des informations déformées sur la santé, sans forcément mentionner ses sources et en s'appuyant sur des ""experts"" auto-désignés : l'inscription en tant qu'expert est gratuite et le site dit explicitement qu'il entend améliorer le référencement et la visibilité de ces intervenants.",http://ooreka.fr/univers/sante,3,Douteux,Site Santé,Autre ou non déterminé,Autre site peu fiable ou douteux,Douteux
215c9fcb-b80c-4f85-ab70-aac5ee1942c5,The Other 98%,"Le site Internet d'une organisation américaine orientée à gauche, qui est notamment favorable aux réductions des inégalités. Le site Politifact a signalé à plusieurs reprises des informations trompeuses véhiculées par ce média.",http://other98.com,3,Douteux,Autre ou non déterminé,Gauche ou centre-gauche,Autre site peu fiable ou douteux,Douteux
7a3fea3b-326c-4a18-bb04-5f16ceb6a4cf,Ouest-France,Un quotidien régional et son site Internet qui appartiennent au groupe SIPA - Ouest-France.,http://ouest-france.fr,4,Plutôt fiable,Média français,Autre ou non déterminé,Média français plutôt fiable,Plutôt fiable
1a027ee5-a0f6-4d23-a08d-1e75dffa047a,Oulala.info,"Un site qui nous apparaît peu fiable, orienté à l'extrême droite qui reprend de nombreuses informations de sources diverses, sans les vérifier systématiquement.",http://oulala.info,2,Peu fiable,Autre ou non déterminé,Extrême-droite,"Site peu fiable ou douteux de droite, d’extrême droite ou pro-russe",Peu fiable droite ou extrême droite
72d3f76a-eae4-475d-9fe9-ec738460d771,Oumma,"Un site communautaire musulman créé en 1999, géré par la SARL Oumma Media. Il a déjà véhiculé des fausses informations, notamment sur l'affaire Merah.",http://oumma.com,3,Douteux,Autre ou non déterminé,Autre ou non déterminé,Autre site peu fiable ou douteux,Douteux
f4b3f557-e4fc-4daa-a889-683156c34d85,Ovni Paranormal,"Un site Internet qui diffuse des théories peu étayées sur les ovnis et les phénomènes paranormaux. Il a également diffusé à plusieurs reprises des informations erronées, notamment le fait que le « lanceur d'alerte » Edward Snowden aurait révélé l'existence d'aliens sous la Terre.",http://ovniparanormal.over-blog.com,2,Peu fiable,Autre ou non déterminé,Conspirationniste,Conspirationniste peu fiable (hors média étranger),Peu fiable conspirationniste
dd871b42-33cd-4be4-b230-d4572eec5d46,Panamza,"Un site alimenté par un ancien étudiant en journalisme, Hicham Hamza. Il relaie des théories du complot, notamment sur l'attentat de Charlie Hebdo.",http://panamza.com,2,Peu fiable,Autre ou non déterminé,Conspirationniste,Conspirationniste peu fiable (hors média étranger),Peu fiable conspirationniste
9c5a1651-f27b-4ff8-9465-63f377786528,Paris Lutte Info,"Un site qui se présente comme anticapitaliste, anti-autoritaire et révolutionnaire.",http://paris-luttes.info,4,Plutôt fiable,Autre ou non déterminé,Gauche ou centre-gauche,Autre sites plutôt fiable,Plutôt fiable
109e59c1-7dc0-43f0-ade6-98e974b218ea,Paris-Normandie,Un quotidien régional et site Internet qui appartient à Xavier Ellie.,http://paris-normandie.fr,4,Plutôt fiable,Média régional français,Autre ou non déterminé,Média régional français plutôt fiable,Plutôt fiable
8a2f9b9e-58dd-4782-8a2f-3f037838771d,Paris Match,"Un hebdomadaire d'actualité et d'images, propriété du groupe Lagardère.",http://parismatch.com,4,Plutôt fiable,Média français,Autre ou non déterminé,Média français plutôt fiable,Plutôt fiable
6782985f-8aa3-4a1f-aabb-56c9bb85fdd4,Paris Vox,"Un site présenté comme un média d'information local neutre, mais orienté à l'extrême droite et qui publie régulièrement de fausses informations.",http://parisvox.info,2,Peu fiable,Média régional français,Extrême-droite,"Site peu fiable ou douteux de droite, d’extrême droite ou pro-russe",Peu fiable droite ou extrême droite
87a8e470-8050-4aeb-b550-af876eabc774,Pars Today,Un site qui nous apparaît peu fiable et qui diffuse régulièrement de fausses informations.,http://parstoday.com/fr,2,Peu fiable,Autre ou non déterminé,Autre ou non déterminé,Autre site peu fiable ou douteux,Peu fiable autre
36859873-76b7-49a2-ba76-3765429f3a45,Pas l'Info,"Un site Internet et une page Facebook affirmant décrypter l'actualité, mais qui diffusent régulièrement des informations déformées, voire erronées. Une de ses vidéos de décembre 2016 présentait ainsi de manière trompeuse un avis consultatif remis au ministère de la santé français sur les vaccins.",http://paslinfo.blogspot.fr,2,Peu fiable,Média français,Autre ou non déterminé,Autre site peu fiable ou douteux,Peu fiable autre
32142b29-4447-4f10-8992-c90717a19d05,Passeport Santé,"Le site, québecois d'origine (la fondation de prévention santé Lucie et André Chagnon a eu la responsabilité de ses contenus pendant dix ans), est alimenté par des médecins et des journalistes. Son responsable éditorial depuis 2011, le français Oxygem Media, éditeur de sites Internet spécialisé dans le bien-être et la consommation, a lui-même été racheté au début de 2015 par le groupe M6. Il détaille son équipe, sa méthodologie dans la rédaction des fiches et sa charte, qui encadre notamment la modération des blogs. Mais les contenus ont été conçus pour un public canadien et n'ont pas forcément été adaptés pour les Français, comme dans le cas de la mélatonine, dont l'usage n'est pas régulé de la même façon dans les deux pays.",http://passeportsante.net,4,Plutôt fiable,Site Santé,Autre ou non déterminé,Autre sites plutôt fiable,Plutôt fiable
f7b439f8-77ce-4c64-a3c3-e88e4863ed32,Patriotes en colère,Un site et une page Facebook d'extrême droite partageant régulièrement des rumeurs et des fausses informations.,http://patriotes-encolere.com,2,Peu fiable,"Blog ou site perso, compte Twitter ou Facebook",Extrême-droite,"Site peu fiable ou douteux de droite, d’extrême droite ou pro-russe",Peu fiable droite ou extrême droite
f611ba31-2eaf-42d4-8d4d-f52bff41971d,Le blog de Paul Jorion,"Paul Jorion est un anthropologue et essayiste belge, professeur associé à l'université catholique de Lille, connu pour avoir annoncé l'imminence de la crise des subprimes. Il traite principalement sur son blog des enjeux économiques.",http://pauljorion.com,4,Plutôt fiable,"Blog ou site perso, compte Twitter ou Facebook",Autre ou non déterminé,Autre sites plutôt fiable,Plutôt fiable
29b91c90-3a3d-4faa-a2d8-9851c9c99338,Pause Cafein,"Un site de divertissement français, spécialisé dans les contenus « insolites » et décalés. Ce site agrège des informations de sources variables sous des titres souvent sensationnalistes, sans forcément les vérifier systématiquement.",http://pausecafein.fr,4,Plutôt fiable,Divertissement ou hobby,Autre ou non déterminé,Parodique ou divertissement plutôt fiable,Plutôt fiable
474bfa08-4f2f-4410-8fe7-5dc1eb264ed5,Pèlerin,Un hebdomadaire catholique français.,http://pelerin.com,4,Plutôt fiable,Média français,Autre ou non déterminé,Média français plutôt fiable,Plutôt fiable
64a8e410-fa07-4cfc-a8a4-351a4f6c6bbf,Penser Librement,Un site qui diffuse des informations sans vérification et des théories conspirationnistes sans preuve réelle.,http://penserlibrement.fr,2,Peu fiable,Autre ou non déterminé,Conspirationniste,Conspirationniste peu fiable (hors média étranger),Peu fiable conspirationniste
1d4a4eea-3c07-4485-9aee-3f09c5f28261,Peuple de France,"Un blog identitaire clairement orienté à l'extrême droite, qui reprend de fausses informations.",http://peupledefrance.com,2,Peu fiable,"Blog ou site perso, compte Twitter ou Facebook",Extrême-droite,"Site peu fiable ou douteux de droite, d’extrême droite ou pro-russe",Peu fiable droite ou extrême droite
06bce5d3-2780-4e63-b5f6-c02f2a2372d9,Pilule rouge,Un blog d'extrême droite qui relaie de nombreuses théories conspirationnistes.,http://pilulerouge.over-blog.com,2,Peu fiable,Autre ou non déterminé,Extrême-droite,"Site peu fiable ou douteux de droite, d’extrême droite ou pro-russe",Peu fiable droite ou extrême droite
d997cfb0-a039-435a-a93e-4c5f0ecd14b8,Piremedias,Un site satirique qui diffuse de nombreux canulars.,http://piremedias.com,1,Parodique,Parodique,Autre ou non déterminé,Parodique ou divertissement plutôt fiable,Parodique
4245baa3-eb03-4c0e-8e62-a0641da8f827,Google+,"Google+ n'est pas une source d'information en soi, mais un réseau social avec des millions d'utilisateurs. Les informations peuvent à la fois émaner de médias « sérieux », de partis politiques mais aussi d'internautes plus ou moins fiables et plus ou moins bien intentionnés. L'information que vous y trouverez dépend donc fondamentalement de son émetteur.",http://plus.google.com,4,Plutôt fiable,"Plateforme, forum, espace-tribune",Autre ou non déterminé,"Plateforme, forum, espace-tribune",Plutôt fiable
074838cb-85eb-4997-a043-b6078a9a3d3e,Pluxactu,Un site qui nous apparaît peu fiable et qui héberge des théories conspirationnistes.,http://pluxactu.com,2,Peu fiable,Média français,Conspirationniste,Conspirationniste peu fiable (hors média étranger),Peu fiable conspirationniste
48b2ce5b-c4e4-434f-8fd1-76e222520eff,Point de Vue,Un hebdomadaire spécialisé dans la vie des familles royales.,http://pointdevue.fr,4,Plutôt fiable,Média français,Autre ou non déterminé,Média français plutôt fiable,Plutôt fiable
f54016f7-d738-44be-b451-de4d26e8d083,Polemia,"Polemia est le think tank de Jean-Yves Le Gallou, une personnalité d'extrême droite. Ce dernier est l'un des promoteurs du concept de « réinformation », qui vise à créer des sites d'information dits « alternatifs », en réalité orientés pour diffuser la pensée politique d'extrême droite.",http://polemia.com,2,Peu fiable,Autre ou non déterminé,Extrême-droite,"Site peu fiable ou douteux de droite, d’extrême droite ou pro-russe",Peu fiable droite ou extrême droite
b50ce29c-8bea-405c-8f16-3e9c08742097,Politico,Un site d'information américain consacré à l'actualité politique.,http://politico.com,4,Plutôt fiable,Média étranger,Autre ou non déterminé,Média étranger plutôt fiable,Plutôt fiable
7ceebd64-1b9b-4610-9abe-2a8b15feba06,Politico Europe,"La version européenne du site d'information américain du même nom, consacré à l'actualité politique européenne vue de Bruxelles.",http://politico.eu,4,Plutôt fiable,Média étranger,Autre ou non déterminé,Média étranger plutôt fiable,Plutôt fiable
f7d1df6b-ef11-4cc8-9dac-66f4c71bd469,Politicops,Un site satirique américain.,http://politicops.com,1,Parodique,Parodique,Autre ou non déterminé,Parodique ou divertissement plutôt fiable,Parodique
3cb42e48-53f6-463a-b4ff-7b3d6fa86280,Politis,Hebdomadaire d'information généraliste proche de la gauche antilibérale et écologiste.,http://politis.fr,4,Plutôt fiable,Média français,Gauche ou centre-gauche,Média français plutôt fiable,Plutôt fiable
5bc3a637-81cf-4f2f-88fe-a440c37e628f,Positivr,"Un site de divertissement francophone, spécialisé dans les articles d'inspiration « positive ». Il agrège des informations de sources variables sous des titres souvent sensationnalistes, sans forcément les vérifier systématiquement.",http://positivr.fr,4,Plutôt fiable,Divertissement ou hobby,Autre ou non déterminé,Parodique ou divertissement plutôt fiable,Plutôt fiable
e2e4dded-3b03-418e-bd25-66353a6ad7c8,Première,Un magazine mensuel consacré au cinéma.,http://premiere.fr,4,Plutôt fiable,Média français,Autre ou non déterminé,Média français plutôt fiable,Plutôt fiable
8fb189d2-0a8f-4eb3-bb65-ba501c00c491,Le Figaro (version abonnés),"La version abonnés du quotidien et site Internet d'information généraliste qui appartient à l'industriel Serge Dassault, classé politiquement à droite.",http://premium.lefigaro.fr,4,Plutôt fiable,Média français,Droite,Média français plutôt fiable,Plutôt fiable
885adc60-50fd-48b9-b768-97df44c3bddf,Présidentielle 2017 info,"Un site Internet en apparence neutre mais en réalité orienté à l'extrême droite, qui reprend notamment sans vérification des articles de sites comme TV Libertés ou Boulevard Voltaire.",http://presidentielle-2017.info,2,Peu fiable,Autre ou non déterminé,Extrême-droite,"Site peu fiable ou douteux de droite, d’extrême droite ou pro-russe",Peu fiable droite ou extrême droite
e75aad0d-109a-479d-9ccf-cc3efe78332d,Presse-Océan,Un quotidien régional et site Internet qui appartiennent au groupe SIPA - Ouest-France.,http://presseocean.fr,4,Plutôt fiable,Média régional français,Autre ou non déterminé,Média régional français plutôt fiable,Plutôt fiable
b8897f53-772d-4c68-ad8f-cdb76962f571,Presstv.ir,Un site iranien qui relaie des théories conspirationnistes et antisémites.,http://presstv.ir,2,Peu fiable,Média étranger,Conspirationniste,Média étranger peu fiable ou douteux,Peu fiable conspirationniste
d23ece74-f3ff-4e19-8277-c961605f779f,Le site du Professeur Henri Joyeux,"Le site du professeur Henri Joyeux, radié de l'ordre des médecins en 2016 notamment pour « des manquements d’une extrême gravité au code de déontologie » et qui met notamment en avant des théories conspirationnistes anti-vaccins.",http://professeur-joyeux.com,2,Peu fiable,"Blog ou site perso, compte Twitter ou Facebook",Conspirationniste,Conspirationniste peu fiable (hors média étranger),Peu fiable conspirationniste
36c99c70-d629-42b2-a448-3fcc03c77617,Télé 7 jours,Un hebdomadaire télévision du groupe Lagardère Active.,http://programme-television.org,4,Plutôt fiable,Média français,Autre ou non déterminé,Média français plutôt fiable,Plutôt fiable
731daf0d-0bf1-4552-ab74-95791ac8f6f0,Télé Loisirs,Un hebdomadaire télévision du groupe Prisma.,http://programme-tv.net,4,Plutôt fiable,Média français,Autre ou non déterminé,Média français plutôt fiable,Plutôt fiable
40696ba9-868d-4b89-b32a-86249fac9a8c,Project Purge,Un blog pro-Trump qui diffuse régulièrement des informations trompeuses ou erronées.,http://projectpurge.com,2,Peu fiable,Autre ou non déterminé,Droite,"Site peu fiable ou douteux de droite, d’extrême droite ou pro-russe",Peu fiable droite ou extrême droite
128f6eef-4382-4a24-b745-3e7097149c6a,Psychologies magazine,Un magazine mensuel français.,http://psychologies.com,4,Plutôt fiable,Média français,Autre ou non déterminé,Média français plutôt fiable,Plutôt fiable
c040879c-b6e4-4849-8f39-a7baf22fdcf8,Public,"Un hebdomadaire de presse people, dont les informations ne sont pas forcément sourcées ou vérifiées, et qui a tendance à exagérer certains faits, notamment dans les titres, dans une démarche sensationnaliste. Par exemple, le site a relayé fin décembre 2016 un article relayant des rumeurs non vérifiées sur la mort de la reine Elizabeth II sous le titre : « Une source anonyme annonce sa mort... »",http://public.fr,4,Plutôt fiable,Média français,Autre ou non déterminé,Média français plutôt fiable,Plutôt fiable
ab74abe9-a7bb-4a31-8a50-5e4388436bc1,Purfi,Un site qui nous apparaît peu fiable et qui héberge des théories conspirationnistes.,http://purfi.com,2,Peu fiable,Autre ou non déterminé,Conspirationniste,Conspirationniste peu fiable (hors média étranger),Peu fiable conspirationniste
55b68557-fbcf-4d1e-bcc8-61c18540bcc9,Quebuzz,"Un site Un site de divertissement français, spécialisé dans les contenus « insolites » et décalés. Ce site agrège des informations de sources variables sous des titres souvent sensationnalistes, sans les vérifier systématiquement.",http://quebuzz.com,3,Douteux,Divertissement ou hobby,Autre ou non déterminé,Autre site peu fiable ou douteux,Douteux
28cf051b-de4e-4aee-b4e2-4258ffb45095,Quenel Plus,"Un site et une page Facebook proches de l'ancien humoriste Dieudonné, condamné à de nombreuses reprises. Ils diffusent régulèrement de fausses informations.",http://quenelplus.com,3,Douteux,"Blog ou site perso, compte Twitter ou Facebook",Autre ou non déterminé,Autre site peu fiable ou douteux,Douteux
c307ac46-e695-40db-9c38-fb0b87508d3c,Quivo France,"Un site de divertissement qui relaie des informations de sources variées, sans forcément les vérifier systématiquement et sous des titres racoleurs. La page comporte aussi des malwares.",http://quivo.co,3,Douteux,Divertissement ou hobby,Autre ou non déterminé,Autre site peu fiable ou douteux,Douteux
98039ecd-7513-433b-bca3-c2e6cffe33de,Radio Cockpit,Un site parodique qui diffuse de nombreux canulars.,http://radiocockpit.fr,1,Parodique,Parodique,Autre ou non déterminé,Parodique ou divertissement plutôt fiable,Parodique
e48e779f-18c5-4319-9c19-2e8af79a6fdb,Radio Courtoisie,"Un radio orientée à l'extrême droite dirigée par Henry de Lesquen, raciste déclaré, et qui présente parfois des informations de manière trompeuse.",http://radiocourtoisie.fr,3,Douteux,Média français,Extrême-droite,"Site peu fiable ou douteux de droite, d’extrême droite ou pro-russe",Douteux
10d1ac78-fda9-44c0-ba7e-90bf2731bc2d,Ravelations,"Un site parodique autour de l'univers de la musique électronique et du clubbing. Les articles sont tous ""complètement faux et tout droit sortir de l'imagination de nos journalistes"", précise la rédaction dans sa page de présentation.",http://ravelations.fr,1,Parodique,Parodique,Autre ou non déterminé,Parodique ou divertissement plutôt fiable,Parodique
54aa39e1-d75b-49e8-b2a3-dfc4d4074585,Rebellyon,"Un site Internet lyonnais qui se présente comme faisant de l'information alternative, orientée à l'extrême gauche.",http://rebellyon.info,4,Plutôt fiable,Média régional français,Extrême-gauche,Média régional français plutôt fiable,Plutôt fiable
669025d8-b7cf-459e-8e72-e95846fa9497,Reddit,"Reddit est un site communautaire où les internautes échangent des liens, des informations que les lecteurs évaluent en donnant des votes positifs ou négatifs. Reddit n'est donc pas une source en soi. Mieux vaut remonter à la source de l'information pour vous faire une idée.",http://reddit.com,4,Plutôt fiable,"Plateforme, forum, espace-tribune",Autre ou non déterminé,"Plateforme, forum, espace-tribune",Plutôt fiable
7f2de43b-758f-4042-8bfa-9be0ad78eae5,Red State Watcher,Un site américain « alternatif » qui relaie parfois de fausses informations.,http://redstatewatcher.com,2,Peu fiable,Média étranger,Autre ou non déterminé,Média étranger peu fiable ou douteux,Peu fiable autre
2dfb7954-5fd9-472a-94f6-52a2a3753e21,Reinformation.tv,"Un site d'extrême droite qui relaie des théories conspirationnistes comme l'idée d'un « grand remplacement » de la population française, en manipulant les chiffres..",http://reinformation.tv,2,Peu fiable,Média français,Extrême-droite,"Site peu fiable ou douteux de droite, d’extrême droite ou pro-russe",Peu fiable droite ou extrême droite
b7c84d52-7f1d-428c-8648-244ecbed204b,Reopen911,Un site conspirationniste qui remet en cause la « version officielle » du 11 septembre 2001.,http://reopen911.info,2,Peu fiable,Autre ou non déterminé,Conspirationniste,Conspirationniste peu fiable (hors média étranger),Peu fiable conspirationniste
fa1b8700-9cd3-434e-a3c1-9b97a42ea3e3,Réponse à tout,"Un magazine mensuel français qui parle de consommation et de vie quotidienne, édité par Fleurus Presse..",http://reponseatout.com,4,Plutôt fiable,Média français,Autre ou non déterminé,Média français plutôt fiable,Plutôt fiable
b5a06bb3-69b1-4b05-b51c-d6fdb0eb5a96,Reporterre,Un site Internet d'information créé par l'ancien journaliste du « Monde » Hervé Kempf consacré à l'environnement et proche du mouvement écologiste.,http://reporterre.net,4,Plutôt fiable,Média français,Autre ou non déterminé,Média français plutôt fiable,Plutôt fiable
795ed632-bce0-4c1b-89f5-a49af00d6a5c,Reptiliens.blogspot,"Un sité dédié au « complot reptilien », qui diffuse des théories douteuses sur la domination du monde par des reptiles humanoïdes.",http://reptiliens.blogspot.fr,2,Peu fiable,Autre ou non déterminé,Conspirationniste,Conspirationniste peu fiable (hors média étranger),Peu fiable conspirationniste
da62665c-d7ab-4b64-9625-afaa22fd5dd0,La Repubblica,"Un journal italien orienté à gauche, parmi les titres les plus vendus du pays, qui appartient en majorité au groupe L'Espresso.",http://repubblica.it,4,Plutôt fiable,Média étranger,Gauche ou centre-gauche,Média étranger plutôt fiable,Plutôt fiable
cbab6eb6-82b6-4ff0-9b2e-756efd4f2b82,Le Républicain lorrain,Un quotidien et site Internet régional qui appartient au groupe BFCM (Banque fédérative du Crédit mutuel).,http://republicain-lorrain.fr,4,Plutôt fiable,Média régional français,Autre ou non déterminé,Média régional français plutôt fiable,Plutôt fiable
cc5cda37-9009-416e-98d9-c792bab13700,Réseau International,Un site d'extrême droite qui diffuse de fausses informations et des théories conspirationnistes.,http://reseauinternational.net,2,Peu fiable,Autre ou non déterminé,Extrême-droite,"Site peu fiable ou douteux de droite, d’extrême droite ou pro-russe",Peu fiable droite ou extrême droite
bb23b33f-005d-4161-8fa3-e3b89e77a75a,Résistance républicaine,Résistance républicaine se revendique « apolitique » mais est néanmoins très proche de l'extrême droite. Il a notamment participé au lancement du « Pegida français » anti-islam.,http://resistancerepublicaine.eu,2,Peu fiable,Autre ou non déterminé,Extrême-droite,"Site peu fiable ou douteux de droite, d’extrême droite ou pro-russe",Peu fiable droite ou extrême droite
d6ff804d-88d3-4b5c-86eb-514ab4ecc06e,Reuters,L'une des principales agences de presse généralistes mondiales.,http://reuters.com,4,Plutôt fiable,Média étranger,Autre ou non déterminé,Média étranger plutôt fiable,Plutôt fiable
8eafc51c-4b24-4787-bf56-4637d5e9ac85,Révolution Vibratoire,"Un blog à tendance conspirationniste, qui reprend notamment les théories de David Icke, un ancien journaliste sportif britannique devenu adepte des théories du complot, notamment sur les reptiliens. Les partisans de cette idée affirment théorie que ces créatures œuvrent dans l'ombre dans le but de manipuler l'espèce humaine..",http://revolutionvibratoire.fr,2,Peu fiable,Autre ou non déterminé,Conspirationniste,Conspirationniste peu fiable (hors média étranger),Peu fiable conspirationniste
01cb655a-1f94-47ba-b6c9-102d5c446502,RFI,"La station de radio publique française diffusée à l'international, en 14 langues.",http://rfi.fr,4,Plutôt fiable,Média français,Autre ou non déterminé,Média français plutôt fiable,Plutôt fiable
b857a98c-1cfd-4431-baab-90d5c14bf557,Rhones Alpes Info,"Un site présenté comme un média d'information local neutre, mais orienté à l'extrême droite et qui publie régulièrement de fausses informations.",http://rhonealpesinfo.fr,2,Peu fiable,Média régional français,Extrême-droite,"Site peu fiable ou douteux de droite, d’extrême droite ou pro-russe",Peu fiable droite ou extrême droite
b4d52618-e825-4da5-98ad-6a6f22d421ce,Riposte laïque,"Un site d'extrême droite, clairement hostile à l'islam, condamné à plusieurs reprises pour provocation à la haine.",http://ripostelaique.com,2,Peu fiable,Média français,Extrême-droite,"Site peu fiable ou douteux de droite, d’extrême droite ou pro-russe",Peu fiable droite ou extrême droite
0e3ec27d-4dfb-4bfd-8fc9-9d17742663b5,Rivarol,"Un journal d'extrême droite condamné à plusieurs reprises par la justice pour des propos racistes, antisémites ou encore des faits d'incitation à la haine raciale.",http://rivarol.com,3,Douteux,Média français,Extrême-droite,"Site peu fiable ou douteux de droite, d’extrême droite ou pro-russe",Douteux
a978b1ca-126a-47c3-af5a-28afc3b8fbfa,Rock City Times,Un site satirique américain.,http://rockcitytimes.com,1,Parodique,Parodique,Autre ou non déterminé,Parodique ou divertissement plutôt fiable,Parodique
