Id,Label,description,attr_home,Decodex,Fiabilité,Catégorie,Orientation contenu,Synthèse,Fiabilité et orientation
bebe7d70-5269-4c5f-8387-cef0679147ed,100% Fed Up,"Un site américain pro-Donald Trump, qui diffuse régulièrement des informations erronées. Par exemple, le site a déformé en mai 2016 des déclarations du nouveau maire de Londres, Sadiq Khan. Il avait ainsi écrit à tort que le maire aurait menacé le nouveau président d'attaques terroristes sur les Etats-Unis s'il ne révisait pas ses positions vis-à-vis des citoyens de confession musulmane.",http://100percentfedup.com,2,Peu fiable,Autre ou non déterminé,Droite,"Site peu fiable ou douteux de droite, d’extrême droite ou pro-russe",Peu fiable droite ou extrême droite
8d3bba8b-5ebf-4698-8e06-8ba644180f5b,2012nouvelmorguemondial,"Un site qui nous apparaît peu fiable et qui héberge des théories conspirationnistes. Il reprend notamment des informations sur les supposés dangers des vaccins contestées par la majorité des spécialistes, sur des traitements miracles contre le cancer ou encore sur la Syrie (comme le mythe de la « petite Syrienne qu'on sauve tout le temps »).",http://2012nouvelmorguemondial.over-blog.com,2,Peu fiable,Autre ou non déterminé,Conspirationniste,Conspirationniste peu fiable (hors média étranger),Peu fiable conspirationniste
f9cb1b3c-b8bd-4f7d-b446-003d9eee3805,2012 un nouveau paradigme,"Un site éclectique qui mélange vraies et fausses informations, et parle notamment de présence extraterrestre sur Terre ou de guerre en Syrie.",http://2012un-nouveau-paradigme.com,2,Peu fiable,Autre ou non déterminé,Conspirationniste,Conspirationniste peu fiable (hors média étranger),Peu fiable conspirationniste
9eecf0bd-627c-411e-9920-6f5f42fa387e,20min.ch,"Le « 20 minutes » suisse, moins fiable que le titre français, à l'origine de plusieurs fausses informations. Le site a par exemple accusé, à tort, un lutteur français d'avoir dédié sa victoire aux terroristes Salah Abdeslam et Mohamed Merah.",http://20min.ch/ro,4,Plutôt fiable,Média étranger,Autre ou non déterminé,Média étranger fiables ou non,Plutôt fiable
48bba69b-7145-42e4-979d-08a9f731b128,20 Minutes,Un quotidien gratuit et site Internet d'information généraliste qui appartient à Rossel et Sipa-Ouest France depuis 2016.,http://20minutes.fr,4,Plutôt fiable,Média français,Autre ou non déterminé,Média français plutôt fiable,Plutôt fiable
c2ad287c-0460-4b0c-bc11-2cb276885422,21st Century Wire,Un site américain « alternatif » qui relaie parfois de fausses informations comme celles sur les « casques blancs » de Syrie. Il diffuse aussi des théories conspirationnistes sur la disparition du vol MH370 de la Malaysia Airlines.,http://21stcenturywire.com,2,Peu fiable,Média étranger,Autre ou non déterminé,Média étranger peu fiable ou douteux,Peu fiable autre
f5233e98-dda4-4100-a393-dec520b1b251,24 heures actu,"Un site dont les auteurs se revendiquent « fiers de ne pas être des journalistes » et défendent le fait d'écrire pour « défendre [leurs] idées », orientées à droite. Peu fiable, il véhicule parfois de fausses informations.",http://24heuresactu.com,4,Plutôt fiable,Média français,Autre ou non déterminé,Média français plutôt fiable,Plutôt fiable
d77fb7f8-5dff-41ae-b724-221b14104217,24matin.ch,Un site satirique qui parodie l'actualité.,http://24matin.ch,1,Parodique,Parodique,Autre ou non déterminé,Parodique ou divertissement plutôt fiable,Parodique
18c48eb8-8b90-4ed6-90a0-53d218d1f0c3,4emesinge,"Un site qui propose des réflexions critiques sur l'économie, l'environnement et la société. Il reprend des informations sans toujours citer ses source, et relaie des informations sans vérification. Par exemple, il affirme de manière catégorique que l'aluminium contenu dans les vaccins est dangereux pour la santé, une affirmation dénoncée par la communauté scientifique.",http://4emesinge.com,3,Douteux,Autre ou non déterminé,Autre ou non déterminé,Autre site peu fiable ou douteux,Douteux
9029572a-6826-41ac-af56-c8b7fe9c0808,M6,Chaîne de télévision généraliste française commerciale privée.,http://6play.fr/m6,4,Plutôt fiable,Média français,Autre ou non déterminé,Média français plutôt fiable,Plutôt fiable
d2518f74-5a08-4f1b-859d-4123028ce606,70 News,Un blog américain qui diffuse régulièrement de fausses informations. Il a notamment affirmé à tort que les votes par correspondance ne sont pas comptabilisés dans tous les Etats américains lors de l'élection présidentielle. Il tentait de démontrer que Donald Trump aurait pu obtenir plus de votes d'électeurs que Hillary Clinton (ce qui s'est avéré faux).,http://70news.wordpress.com,2,Peu fiable,Média étranger,Autre ou non déterminé,Média étranger peu fiable ou douteux,Peu fiable autre
d0301ee9-b56d-4a7a-a881-584f70ac0d0d,9gag,"9gag n'est pas une source d'information en soi, mais un vaste blog où les internautes postent des images, des vidéos ou encore des liens. Mieux vaut remonter à la source de l'information pour vous faire une idée.",http://9gag.com,4,Plutôt fiable,Divertissement ou hobby,Autre ou non déterminé,Parodique ou divertissement plutôt fiable,Plutôt fiable
dd1cb2f9-47c0-48d4-8427-99d992ba07a6,ABC News .co,"Une fausse réplique du site d'« ABC News », qui utilise abusivement le nom de cette télévision américaine pour diffuser de fausses informations.",http://abcnews.com.co,2,Peu fiable,Autre ou non déterminé,Autre ou non déterminé,Autre site peu fiable ou douteux,Peu fiable autre
93fb42a5-3161-444f-9a47-d4a6d4ad6f09,ABC,Le site de la chaîne d'information américaine ABC News.,http://abcnews.go.com,4,Plutôt fiable,Média étranger,Autre ou non déterminé,Média étranger plutôt fiable,Plutôt fiable
c2e42800-f147-4647-b705-47adbce8be30,ABC News Go,Un faux site d'information en anglais qui ressemble à celui du réseau de chaînes de télévision américain ABC.,http://abcnewsgo.co,1,Parodique,Parodique,Autre ou non déterminé,Parodique ou divertissement plutôt fiable,Parodique
1b2f2e27-7dcc-4112-b90b-81065f50dd49,Le Monde (édition abonnés),"Un quotidien et site Internet d'information généraliste. Le groupe est détenu depuis 2010 par les hommes d'affaires Xavier Niel, Pierre Bergé et Matthieu Pigasse.",http://abonnes.lemonde.fr,4,Plutôt fiable,Média français,Autre ou non déterminé,Média français plutôt fiable,Plutôt fiable
3dc0daa2-7825-4a29-97f9-69c36bb94d39,Le Monde (édition abonnés mobile),"Un quotidien et site Internet d'information généraliste. Le groupe est détenu depuis 2010 par les hommes d'affaires Xavier Niel, Pierre Bergé et Matthieu Pigasse.",http://abonnes.mobile.lemonde.fr,4,Plutôt fiable,Média français,Autre ou non déterminé,Média français plutôt fiable,Plutôt fiable
4f7c617e-a381-456b-9778-5edf6d079fce,Acrimed,"Acrimed (Action critique médias) est une association qui, comme son nom l'indique, se veut être un observatoire critique des médias. Plutôt classé comme marqué à gauche, Acrimed se donne pour objectif d'informer sur l'information et d'analyser les liens entre le journalisme et les pouvoirs économiques et politiques.",http://acrimed.org,4,Plutôt fiable,Média français,Gauche ou centre-gauche,Média français plutôt fiable,Plutôt fiable
2d530368-efac-4e6c-8014-4020cc692fc6,Activist Post,"Un site d'information américain à tendance conspirationniste, qui diffuse parfois de fausses informations. Il a notamment écrit que la théorie du « Pizzagate », qui affirmait sans preuve qu'un réseau pédophile dirigé par des proches de Hillary Clinton sévissait dans une pizzeria de Washington, était une fausse théorie conspirationniste inventée par des médias américains traditionnels et destinée à être facilement démontée pour discréditer ceux qui l'auraient relayée.",http://activistpost.com,2,Peu fiable,Média étranger,Conspirationniste,Média étranger peu fiable ou douteux,Peu fiable conspirationniste
428fc69e-bdec-4e7f-a55e-bd279d24b360,Orange actu,Le portail d'Orange consacré à l'actualité. Il agrège des contenus de différents sites. Il vaut donc mieux s'informer au cas par cas sur ces derniers pour en savoir plus.,http://actu.orange.fr,4,Plutôt fiable,Média français,Autre ou non déterminé,Média français plutôt fiable,Plutôt fiable
69828fce-97b0-4f54-b541-027166f9a121,Actualite.co,Un site qui permet à n'importe quel internaute de créer un article fictif et de le partager sur les réseaux sociaux.,http://actualite.co,1,Parodique,Parodique,Autre ou non déterminé,Parodique ou divertissement plutôt fiable,Parodique
b801db8e-f57a-4d78-b966-cd3a5fc17e0e,Actualites.co,Un site qui permet à n'importe quel internaute de créer un article fictif et de le partager sur les réseaux sociaux.,http://actualites.co,1,Parodique,Parodique,Autre ou non déterminé,Parodique ou divertissement plutôt fiable,Parodique
edebae23-da2c-4327-8627-6d2a17f9fe8a,Addictinginfo,"Un site américain très orienté, pro-démocrates, qui diffuse parfois des informations sensationnalistes ou déformées.",http://addictinginfo.org,3,Douteux,Média étranger,Gauche ou centre-gauche,Média étranger peu fiable ou douteux,Douteux
f946f03b-7130-4245-b2c1-887c33401a97,AE911truth,"Un site conspirationniste qui remet en cause la « version officielle » des attentats 11-Septembre, sans preuve réelle. Plusieurs sites comme Metabunk ou 911myths ont déconstruit ses théories en revenant aux faits.",http://ae911truth.org,2,Peu fiable,Autre ou non déterminé,Conspirationniste,Conspirationniste peu fiable (hors média étranger),Peu fiable conspirationniste
bf9a871f-6b1d-4006-925c-7ec211584789,AFP,"L'Agence France-Presse (AFP) est la principale agence de presse généraliste française, implantée dans environ 195 pays. La vérification de ses informations et la mention systématique des sources sont parmi ses principaux piliers, lui donnant une très grande fiabilité en règle générale.",http://afp.com,4,Plutôt fiable,Média français,Autre ou non déterminé,Média français plutôt fiable,Plutôt fiable
ad752c68-e394-43ae-803d-d645ad94514f,Agence Info Libre,"Un site qui se présente comme une agence de presse classique, mais est proche de l'extrême droite et estime que des sociétés secrètes dirigent le monde.",http://agenceinfolibre.fr,3,Douteux,Autre ou non déterminé,Extrême-droite,"Site peu fiable ou douteux de droite, d’extrême droite ou pro-russe",Douteux
355f16df-d474-4422-808c-b907faa3f322,Agoravox,"Une plateforme participative qui n'est pas orientée idéologiquement, mais de nombreux contributeurs du site s'en servent notamment pour relayer des théories conspirationnistes.",http://agoravox.fr,4,Plutôt fiable,"Plateforme, forum, espace-tribune",Autre ou non déterminé,"Plateforme, forum, espace-tribune",Plutôt fiable
d3d8630c-c154-4a31-8003-6322b34981dc,AJ+,"Un média d'information de la chaîne de télévision arabe Al Jazeera (propriété du Qatar), qui diffuse des contenus d'information pensés pour les réseaux sociaux, principalement des vidéos.",http://ajplus.net,4,Plutôt fiable,Média étranger,Autre ou non déterminé,Média étranger plutôt fiable,Plutôt fiable
b32025b3-e297-4db8-ae4b-44291072bcb6,Al Kanz,"Al-Kanz, essentiellement animé par une seule personne, publie des articles et des tribunes sur toute actualité relative à la culture musulmane, en reprenant, sans toujours les vérifier, des informations de sources variées sur cette thématique.",http://al-kanz.org,4,Plutôt fiable,Média français,Autre ou non déterminé,Média français plutôt fiable,Plutôt fiable
75c24c4a-b221-4421-8ef0-adbc4119724d,alalumieredunouveaumonde,Un site qui nous apparaît peu fiable et qui héberge des théories conspirationnistes sur les extraterrestres et relaie des rumeurs sur la mort de personnalités toujours en vie.,http://alalumieredunouveaumonde.blogspot.fr,2,Peu fiable,Autre ou non déterminé,Conspirationniste,Conspirationniste peu fiable (hors média étranger),Peu fiable conspirationniste
8917588d-47bf-41bc-95aa-44d872aaa44c,Al Jazeera,"Chaîne de télévision arabe, propriété du Qatar, qui émet notamment en arabe et en anglais.",http://aljazeera.com,4,Plutôt fiable,Média étranger,Autre ou non déterminé,Média étranger plutôt fiable,Plutôt fiable
d7dd134d-7a2a-4f98-962b-41bcc0a90086,Allo Docteurs,Le site de l'émission de la chaîne audiovisuelle publique France 5. Il est alimenté par des médecins et des journalistes. Leur rubrique « le faux de l'info » vérifie les rumeurs ou les informations virales.,http://allodocteurs.fr,4,Plutôt fiable,Média français,Autre ou non déterminé,Média français plutôt fiable,Plutôt fiable
f7c90042-9e9f-4a50-b8ef-6c9c68278209,Alter Info,"Un site qui se présente comme une « agence de presse associative » et se veut « antisioniste ». Il a été condamné pour des propos antisémites, raconte « L'Express ». Comme le souligne « Rue89 »  dans un article, ce site diffuse régulièrement des théories conspirationnistes.",http://alterinfo.net,2,Peu fiable,Média français,Conspirationniste,Conspirationniste peu fiable (hors média étranger),Peu fiable conspirationniste
798b68d6-23e2-4338-8340-23597a485dcb,Alternatives Economiques,"Un site et un magazine consacrés à l'économie et au social, qui se place dans une tradition économique héritée de Keynes et du régulationnisme. Le site, fondé par l'économiste Denis Clerc, est détenu par ses salariés.",http://alternatives-economiques.fr,4,Plutôt fiable,Média français,Autre ou non déterminé,Média français plutôt fiable,Plutôt fiable
a4f0a40b-a401-4d68-9aaf-06e7249baad2,Alternet,"Un site Internet américain, plutôt classé à gauche, créé par Don Hazen, ancien rédacteur en chef de Mother Jones.",http://alternet.org,4,Plutôt fiable,Média étranger,Gauche ou centre-gauche,Média étranger plutôt fiable,Plutôt fiable
ef317dab-f540-4ca5-8eb5-1374f8c4e010,Ameli,Il s'agit du site officiel de l'Assurance-maladie française. Les informations disponibles ont été rédigées et validées par des professionnels de santé.,http://ameli-sante.fr,4,Plutôt fiable,Site Santé,Autre ou non déterminé,Autre sites plutôt fiable,Plutôt fiable
f25acf47-952c-418c-859a-029453cdb51f,American News,"Un site américain peu fiable qui produit des informations présentées de manière trompeuse, sans vérification et sous des titres racoleurs. Il a par exemple affirmé à tort, en 2014, que l'armée américaine aurait cédé aux pressions des musulmans en acceptant des tenues religieuses, déformant une décision de l'armée américaine.",http://americannews.com,2,Peu fiable,Média étranger,Autre ou non déterminé,Média étranger peu fiable ou douteux,Peu fiable autre
b75956aa-c303-4bf9-b86f-f5ff1493db48,American News X,"Un site Internet américain orienté à gauche, à lire avec prudence, car il mélange articles satiriques et articles d'information.",http://americannewsx.com,3,Douteux,Divertissement ou hobby,Gauche ou centre-gauche,Autre site peu fiable ou douteux,Douteux
4f5c641b-6de1-40d9-8169-d592bc89094f,Amplifying Glass,Un site satirique américain.,http://amplifyingglass.com,1,Parodique,Parodique,Autre ou non déterminé,Parodique ou divertissement plutôt fiable,Parodique
f59ac851-f9d5-4a68-bbfe-f3d5846001ec,Anonews.co,"Un site américain qui diffuse parfois de fausses informations. Il a notamment relayé la théorie du « Pizzagate », qui affirmait sans preuve qu'un réseau pédophile dirigé par des proches de Hillary Clinton sévissait dans une pizzeria de Washington.",http://anonews.co,2,Peu fiable,Média étranger,Autre ou non déterminé,Média étranger peu fiable ou douteux,Peu fiable autre
0262275c-2e08-4ac3-88d9-eea548577e6c,Associated Press,"Associated Press (AP) est l'une des principales agences de presse généralistes mondiales, qui diffuse de manière générale des informations vérifiées en précisant systématiquement ses sources.",http://ap.org,4,Plutôt fiable,Média étranger,Autre ou non déterminé,Média étranger plutôt fiable,Plutôt fiable
8e1367a2-bdfa-4c49-a1b9-37baa0369b3a,Arcturius,"Un site qui nous apparaît peu fiable et qui reprend des théories conspirationnistes, notamment celle des « chemtrails ». Il s'agit d'une théorie qui affirme que les trainées de condensation dans le sillage des avions ne seraient pas de la vapeur d'eau mais des produits chimiques délibérément répandus par les agences gouvernementales et militaires, qui chercheraient à modifier le climat et manipuler les populations.",http://arcturius.org,2,Peu fiable,Autre ou non déterminé,Conspirationniste,Conspirationniste peu fiable (hors média étranger),Peu fiable conspirationniste
42a19d95-d67b-4051-9d3e-b6fd9361cb5b,Arrêt sur images,"Un site Internet d'information et d'analyse des médias, né après la suppression de l'émission du même nom sur France 5.",http://arretsurimages.net,4,Plutôt fiable,Média français,Autre ou non déterminé,Média français plutôt fiable,Plutôt fiable
ce1348c2-a4bb-48fe-8cb7-32ef61176543,Arret sur Info,"Un site Internet qui publie ses propres analyses et reprend des informations de divers sites et contributeurs, pour certains peu fiables comme Sputnik News ou Pravda.ru. On y trouve également des analyses d'auteurs conspirationnistes, comme le journaliste américain Paul Craig Roberts, qui affirme que l'attentat contre Charlie Hebdo était une opération américaine pour punir la France de son indépendance vis-à-vis des Etats-Unis. A prendre avec des pincettes.",http://arretsurinfo.ch,2,Peu fiable,Média français,Autre ou non déterminé,Autre site peu fiable ou douteux,Peu fiable autre
6818d34e-d3f2-4e20-8b9b-ab0d91bcb188,Arte,Chaîne de télévision culturelle de service public franco-allemande.,http://arte.tv/fr,4,Plutôt fiable,Média français,Autre ou non déterminé,Média français plutôt fiable,Plutôt fiable
ba52784c-6ec7-4278-9a9d-84d3bd75c128,Asahi Shinbun,"Un quotidien et site Internet japonais, l'un des principaux titres du pays, classé politiquement au centre gauche, et clairement pacifiste.",http://asahi.com,4,Plutôt fiable,Média étranger,Gauche ou centre-gauche,Média étranger plutôt fiable,Plutôt fiable
8c39c690-a98d-4b52-94ff-89798fff51eb,Astuces naturelles,"Ce site se présente comme « à but informatif uniquement » et qui « ne prétend aucunement à une expertise médicale avisée ». Pourtant, outre des remèdes fantaisistes contre le cancer (manger plus de légumes serait plus efficace qu'une chimiothérapie, selon ses auteurs), il propose des thèses conspirationnistes, par exemple sur les vaccins. Aucune information n'est disponible sur les auteurs et le financement de ce site.",http://astucesnaturelles.net,2,Peu fiable,Site Santé,Conspirationniste,Conspirationniste peu fiable (hors média étranger),Peu fiable conspirationniste
c091771e-b502-4a5e-8284-351021e89896,Atlantico,"Un pure player français d'orientation libérale et conservatrice. Le site est à l'origine de plusieurs scoops comme les enregistrements secrets de Nicolas Sarkozy par son ancien conseiller Patrick Buisson, mais a plusieurs fois repris des informations sans vérification.",http://atlantico.fr,4,Plutôt fiable,Média français,Droite,Média français plutôt fiable,Plutôt fiable
85977c6a-386f-4454-b04d-682335f27409,Avortement.net,"Un site anti-avortement qui est présenté comme un centre d'écoute et d'information sur l'IVG, sans que son parti pris n'apparaisse clairement.",http://avortement.net,2,Peu fiable,Site Santé,Droite,"Site peu fiable ou douteux de droite, d’extrême droite ou pro-russe",Peu fiable droite ou extrême droite
7aa635b8-9475-42b9-adbd-60ae27ef829d,Ayoye France,"Un site de divertissement qui relaie des informations de sources variées, sans forcément les vérifier systématiquement et sous des titres racoleurs.",http://ayoye.com,3,Douteux,Divertissement ou hobby,Autre ou non déterminé,Autre site peu fiable ou douteux,Douteux
63265246-6571-4b2b-9ef5-51e67932f638,Bare Naked Islam,"Un site islamophobe américain, qui diffuse régulièrement de fausses informations.",http://barenakedislam.com,2,Peu fiable,Média étranger,Autre ou non déterminé,Média étranger peu fiable ou douteux,Peu fiable autre
e6f17f76-6555-4c0e-9efe-0c1f45fafc08,Basta !,"Site d'actualité marqué à gauche édité par l'association Alter-médias, alimenté par des journalistes et militants associatifs. Il se définit comme une « agence d’informations indépendantes sur l’environnement et les alternatives sociales ».",http://bastamag.net,4,Plutôt fiable,Média français,Gauche ou centre-gauche,Média français plutôt fiable,Plutôt fiable
772a15d2-94ad-4da9-81c2-42abe262dca4,Bataii.com,"Un site qui propose aux internautes de donner leur avis sur des sujets variés, notamment politiques, sans appliquer de méthodologie qui rende ces pseudo-sondages représentatifs de la population française.",http://bataii.com,2,Peu fiable,Autre ou non déterminé,Autre ou non déterminé,Autre site peu fiable ou douteux,Peu fiable autre
051d480b-52ea-4e60-83d2-b3ed9413f6ea,BBC,"Un groupe de radio-télévision britannique qui diffuse à l'international, réputé pour son sérieux.",http://bbc.com,4,Plutôt fiable,Média étranger,Autre ou non déterminé,Média étranger plutôt fiable,Plutôt fiable
ef79b89f-13f9-490b-8782-8f642358025e,Be,Un hebdomadaire féminin.,http://be.com,4,Plutôt fiable,Média français,Autre ou non déterminé,Média français plutôt fiable,Plutôt fiable
f64f4892-89ae-4e3a-9efd-491eb1d41b65,Before it's news,"Un site américain connu pour avoir posté de fausses informations, notamment sur une comète censée engendrer le « chaos » sur Terre en 2015.",http://beforeitsnews.com,3,Douteux,Média étranger,Autre ou non déterminé,Média étranger peu fiable ou douteux,Douteux
81f8b812-ca04-4d37-ac9e-64103b1b15c2,Being Liberal,"Un site américain orienté clairement à gauche, qui publie parfois des informations trompeuses. Le site américain Politifact, qui repère les fausses affirmations, explique que Being Liberal a ainsi inventé des citations attribuées à des élus républicains.",http://beingliberal.tumblr.com,3,Douteux,Autre ou non déterminé,Gauche ou centre-gauche,Autre site peu fiable ou douteux,Douteux
4bb25fa0-e4f7-4edb-a511-7eb92157da40,BFMTV,"Chaîne de télévision d'information en continu, propriété du groupe NextRadio TV.",http://bfmtv.com,4,Plutôt fiable,Média français,Autre ou non déterminé,Média français plutôt fiable,Plutôt fiable
6abfb7c1-fe97-4cd3-bf04-c03d91bcef84,Biba,Un magazine mensuel féminin.,http://bibamagazine.fr,4,Plutôt fiable,Média français,Autre ou non déterminé,Média français plutôt fiable,Plutôt fiable
568a4e1f-9641-47f6-964f-70123efbb107,Le Bien public,Un quotidien et site Internet régional qui appartient au groupe EBRA.,http://bienpublic.com,4,Plutôt fiable,Média régional français,Autre ou non déterminé,Média régional français plutôt fiable,Plutôt fiable
eed04660-8128-4dfd-b20b-ac812697652b,Bilboquet Magazine,Un site satirique qui parodie l'actualité de l'éducation.,http://bilboquet-magazine.fr,1,Parodique,Parodique,Autre ou non déterminé,Parodique ou divertissement plutôt fiable,Parodique
d4e7d0f7-caf9-4987-a3dc-e71cd1ad88cb,Bipartisan Report,Un site américain orienté à gauche qui publie parfois des informations trompeuses ou exagérées.,http://bipartisanreport.com,3,Douteux,Média étranger,Gauche ou centre-gauche,Média étranger peu fiable ou douteux,Douteux
eede6518-ebd3-4abd-831b-a2df027a7150,Les blogs du Monde,"Il ne s'agit pas d'articles du « Monde », mais de blogs hébergés par le site. Cette section regroupe plusieurs cas différents : les blogs invités et sélectionnés de la rédaction, mais aussi les blogs créés par des abonnés, indépendamment de la rédaction. Leur pertinence ne peut donc être jugée qu'au cas par cas.",http://blog.lemonde.fr,4,Plutôt fiable,"Plateforme, forum, espace-tribune",Autre ou non déterminé,"Plateforme, forum, espace-tribune",Plutôt fiable
022ffb9f-f3a0-4b00-87d7-fdcc49556fcf,Les blogs du Monde Diplomatique,"Il ne s'agit pas d'articles du « Monde Diplomatique », mais de blogs hébergés par le site. Leur pertinence ne peut donc être jugée qu'au cas par cas.",http://blog.mondediplo.net,4,Plutôt fiable,"Plateforme, forum, espace-tribune",Autre ou non déterminé,"Plateforme, forum, espace-tribune",Plutôt fiable
35c6f35f-8eb0-414f-b0de-d485cab2e494,Les blogs de Mediapart,"Il ne s'agit pas d'articles de « Mediapart», mais de blogs hébergés par le site. Cette section regroupe plusieurs cas différents : les blogs invités et sélectionnés de la rédaction, mais aussi les blogs créés par des internautes, indépendamment de la rédaction. Leur pertinence ne peut donc être jugée qu'au cas par cas.",http://blogs.mediapart.fr,4,Plutôt fiable,"Plateforme, forum, espace-tribune",Autre ou non déterminé,"Plateforme, forum, espace-tribune",Plutôt fiable
d378890c-3ffb-4d3f-b030-74d5f7fc9538,Bloomberg,Un grand groupe de presse américain qui regroupe notamment une agence de presse (Bloomberg News) et une chaîne de télévision (Bloomberg TV). Toutes deux sont spécialisées dans les informations économiques et financières.,http://bloomberg.com,4,Plutôt fiable,Média étranger,Autre ou non déterminé,Média étranger plutôt fiable,Plutôt fiable
