Id,Label,description,attr_home,Decodex,Fiabilité,Catégorie,Orientation contenu,Synthèse,Fiabilité et orientation
2cafbde9-e946-4a43-8999-393dc43406ef,Dailymotion,"Dailymotion n'est pas une source d'information en soi, mais une plateforme de partage de vidéos avec des informations pouvant à la fois émaner de médias « sérieux », de partis politiques et d'internautes plus ou moins fiables et plus ou moins bien intentionnés. L'information que vous y trouverez dépend donc fondamentalement de son émetteur.",http://dailymotion.com,4,Plutôt fiable,"Plateforme, forum, espace-tribune",Autre ou non déterminé,"Plateforme, forum, espace-tribune",Plutôt fiable
835f2abd-8d91-4bc6-8b67-24b28c820d9b,DailyNewsBin,Un site politique américaine fortement orienté à l'extrême gauche et clairement anti-Trump qui publie régulièrement des informations trompeuses ou approximatives.,http://dailynewsbin.com,2,Peu fiable,Média étranger,Extrême-gauche,Média étranger peu fiable ou douteux,Peu fiable autre
d0d694f1-8311-497f-86b7-266265c006ef,Darons,Un site satirique qui diffuse de nombreux canulars.,http://darons.net,1,Parodique,Parodique,Autre ou non déterminé,Parodique ou divertissement plutôt fiable,Parodique
d590e045-2f54-419f-870d-a4df6aa58db0,David Icke,"Un ancien journaliste sportif britannique devenu adepte des théories du complot, notamment sur les reptiliens. Les partisans de cette idée affirment théorie que ces créatures œuvrent dans l'ombre dans le but de manipuler l'espèce humaine.",http://davidicke.com,2,Peu fiable,"Blog ou site perso, compte Twitter ou Facebook",Conspirationniste,Conspirationniste peu fiable (hors média étranger),Peu fiable conspirationniste
754b2162-e415-43c1-8296-8fa970371606,DC Posts,"Un site américain qui relaie parfois de fausses informations, notamment des théories conspirationnistes sur l'affaire dite du Pizzagate.",http://dcposts.com,2,Peu fiable,Média étranger,Conspirationniste,Média étranger peu fiable ou douteux,Peu fiable conspirationniste
5e98dc0e-3068-4773-abca-d7d486828432,Debunkers de hoax,"Un site de vérification des rumeurs, focalisé sur celles qui émanent de l'extrême droite. Le site est en principe plutôt fiable, mais adopte un positionnement politique et un ton très tranchés.",http://debunkersdehoax.org,4,Plutôt fiable,Autre ou non déterminé,Gauche ou centre-gauche,Autre sites plutôt fiable,Plutôt fiable
314d0f86-7555-4313-bf84-f1514f24c1b4,DemicMedia,Un site qui nous apparaît peu fiable et qui produit des informations parfois erronées sous des titres racoleurs. On y lit par exemple que boire de la Tequila chaque jour aurait des effets bénéfiques pour la santé.,http://demicmedia.com,2,Peu fiable,Autre ou non déterminé,Autre ou non déterminé,Autre site peu fiable ou douteux,Peu fiable autre
764f11a8-1e0d-48a3-b0af-1b96a61e0ec2,Demotivateur,"Un site se présentant comme « média global de divertissement français ». Il est spécialisé dans les contenus « insolites », mais se contente en général de reprises plus ou moins fidèles, et diffuse parfois des informations incomplètes ou déformées.",http://demotivateur.fr,3,Douteux,Divertissement ou hobby,Autre ou non déterminé,Autre site peu fiable ou douteux,Douteux
76b5c6d3-fdc2-46ed-9d19-8bcb1e0efb51,Denver Guardian,"Un faux site américain à l'origine de plusieurs fausses informations relayées de manière massive au cours de la dernière campagne présidentielle, selon BuzzFeed.",http://denverguardian.com,2,Peu fiable,Autre ou non déterminé,Droite,"Site peu fiable ou douteux de droite, d’extrême droite ou pro-russe",Peu fiable droite ou extrême droite
c3fd6dec-0491-4b56-bcbd-4e928af3ca3e,Denver Post,Un des principaux quotidiens d'information sur Denver et le Colorado.,http://denverpost.com,4,Plutôt fiable,Média étranger,Autre ou non déterminé,Média étranger plutôt fiable,Plutôt fiable
d5d7ce30-e556-404f-a05b-0fc1eb486466,Departed Media,"Un site américain qui relaie parfois de fausses informations, notamment des théories conspirationnistes sur l'affaire dite du Pizzagate..",http://departedmedia.info,2,Peu fiable,Média étranger,Conspirationniste,Média étranger peu fiable ou douteux,Peu fiable conspirationniste
177c5830-a48c-46ae-9cc1-d5bebc8fcdd3,Dernières nouvelles du dragon,"Un site qui nous apparaît peu fiable et qui relaie de nombreuses théories conspirationnistes, notamment la prétendue théorie du « Pizzagate», sur un faux scandale pédophile aux Etats-Unis.",http://dernieresnouvellesdudragon.blogspot.fr,2,Peu fiable,Autre ou non déterminé,Conspirationniste,Conspirationniste peu fiable (hors média étranger),Peu fiable conspirationniste
c8ca429d-bb77-414a-a832-b63aa1ab74c9,Der Standard,"Un quotidien et site d'information allemand, plutôt classé au centre gauche et libéral sur le plan sociétal.",http://derstandard.at,4,Plutôt fiable,Média étranger,Gauche ou centre-gauche,Média étranger plutôt fiable,Plutôt fiable
d2798977-5774-4874-a3df-e55bf59fcf2f,Désencyclopédie,Une parodie de Wikipédia.,http://desencyclopedie.wikia.com,1,Parodique,Parodique,Autre ou non déterminé,Parodique ou divertissement plutôt fiable,Parodique
9d8ba35d-6189-4133-ab46-c12d2f53484c,Diatala,Un site qui nous apparaît peu fiable et qui héberge de fausses informations et des théories sur les extraterrestres et de prétendues sociétés secrètes qui domineraient le monde.,http://diatala.org,2,Peu fiable,Autre ou non déterminé,Conspirationniste,Conspirationniste peu fiable (hors média étranger),Peu fiable conspirationniste
e4af4047-030a-41a3-ada2-b8ca279e1d76,Dieudosphere (Dieudonné),"Le site de l'humoriste controversé Dieudonné, plusieurs fois condamné pour antisémitisme et incitation à la haine raciale, qui relaie régulièrement de fausses informations.",http://dieudosphere.com,2,Peu fiable,"Blog ou site perso, compte Twitter ou Facebook",Extrême-droite,"Site peu fiable ou douteux de droite, d’extrême droite ou pro-russe",Peu fiable droite ou extrême droite
ba6aecee-14aa-43c3-8038-1474a2731046,Diktacratie,Un blog qui prétend « démystifer la démocratie ». Il publie régulièrement des informations déformées ou erronées.,http://diktacratie.com,2,Peu fiable,"Blog ou site perso, compte Twitter ou Facebook",Autre ou non déterminé,Autre site peu fiable ou douteux,Peu fiable autre
449aa496-e8c5-49c7-bcc9-0ef0202c0956,Direct matin,"Un quotidien gratuit et site Internet d'information généraliste qui appartient au groupe de médias de Vincent Bolloré, également propriétaire de Canal +.",http://directmatin.fr,4,Plutôt fiable,Média français,Autre ou non déterminé,Média français plutôt fiable,Plutôt fiable
3ccb37b4-e833-48cb-a2be-7e0bb42df230,Dirty Biology,"Une chaîne YouTube de vulgarisation scientifique créée par Léo Grasset, titulaire d'un master en biologie.",http://dirtybiology.com,4,Plutôt fiable,Média français,Autre ou non déterminé,Média français plutôt fiable,Plutôt fiable
81b914f4-4c47-4d6b-8753-332a68959fe1,Disclose TV,Un site américain qui revendique le fait de diffuser des théories conspirationnistes.,http://disclose.tv,2,Peu fiable,Autre ou non déterminé,Conspirationniste,Conspirationniste peu fiable (hors média étranger),Peu fiable conspirationniste
bf3278ef-aaa7-4cec-b597-1a62f4de8ad8,Disinfo,Un site américain qui diffuse de fausses informations.,http://disinfo.com,2,Peu fiable,Autre ou non déterminé,Autre ou non déterminé,Autre site peu fiable ou douteux,Peu fiable autre
14beff87-1bf2-43fd-b78c-50da10cf9720,Dernières Nouvelles d'Alsace,Un quotidien et site Internet régional qui appartient au groupe BFCM.,http://dna.fr,4,Plutôt fiable,Média régional français,Autre ou non déterminé,Média régional français plutôt fiable,Plutôt fiable
65f6978f-8a19-4993-96d4-201de51abd6e,Doctissimo,"Un site Internet consacré au bien-être et à la santé. Attention : certains articles sont signés par des médecins, d'autres non. Créé par deux médecins en 2000, il a été racheté par le groupe Lagardère en 2008. Le site précise : « Nos rédacteurs se sont spécialisés dans un domaine de santé mais ne sont pas tous des professionnels de la santé. Tout le contenu santé - bien-être est revu et validé par notre rédacteur en chef et notre directeur médical avant publication. » Le 21 février 2017, le groupe Le Monde et Doctissimo ont annoncé s'associer pour lancer « Sens & Santé », un magazine bimestriel.",http://doctissimo.fr,4,Plutôt fiable,Site Santé,Autre ou non déterminé,Autre sites plutôt fiable,Plutôt fiable
ab1be46b-cd90-47c6-92d5-6f2c0fe4bb35,Dondevamos,"Un site qui nous apparaît peu fiable et qui héberge des théories conspirationnistes, notamment sur l'affaire dite du Pizzagate aux Etats-Unis.",http://dondevamos.canalblog.com,2,Peu fiable,Autre ou non déterminé,Conspirationniste,Conspirationniste peu fiable (hors média étranger),Peu fiable conspirationniste
ef3f4482-1b15-451f-8e68-d960e4fcf932,Dreuz Info,"Un blog qui se revendique comme « pro-américain », « pro-israélien » et « néo-conservateur ». Il publie régulièrement de fausses informations, notamment sur l'immigration.",http://dreuz.info,2,Peu fiable,"Blog ou site perso, compte Twitter ou Facebook",Autre ou non déterminé,Autre site peu fiable ou douteux,Peu fiable autre
7c803343-5702-434e-9040-37aa355f42f1,Drudge Report,"Un blog américain conservateur qui agrège des informations de nombreuses sources. Il a relayé nombre de fausses rumeurs et affirmations approximatives, notamment sur la santé d'Hillary Clinton.",http://drudgereport.com,3,Douteux,"Blog ou site perso, compte Twitter ou Facebook",Autre ou non déterminé,Autre site peu fiable ou douteux,Douteux
e5c73fd6-a2d3-49a0-8aa3-6cf4509e3484,e-penser (Bruce Benamran),"Une chaîne YouTube consacrée à la vulgarisation scientifique créée par un ingénieur logiciel, Bruce Benamran, en 2013. Ses vidéos ont depuis trouvé un public et Bruce Benamran a publié plusieurs livres tirés de son travail sur sa chaîne YouTube. Il a également fait la première partie de l'Exoconférrence, un spectacle de l'humoriste Alexandre Astier.",http://e-penser.com,4,Plutôt fiable,Autre ou non déterminé,Autre ou non déterminé,Autre sites plutôt fiable,Plutôt fiable
f52e79c1-147d-418f-8e0b-f359c850d158,E-sante,"Le site E-santé, propriété du groupe éponyme établi à Paris, revendique « une information scientifiquement exacte au moment de sa parution, fiable, pertinente et intelligible ». Les dossiers sont sourcés et signés. Attention, plusieurs publications d'actualité correspondent à des reprises d'« études » sans mise en perspective, et certains « articles » sont en réalité des tribunes de professionnels de santé, juges et parties dans les questions traitées, comme par exemple une étude de la National Sleep Foundation conseillant d'investir dans une bonne literie...",http://e-sante.fr,4,Plutôt fiable,Site Santé,Autre ou non déterminé,Autre sites plutôt fiable,Plutôt fiable
a43ba1e0-c222-4d5f-a35c-6815c039cc0b,L'échelle de Jacob,"Un blog qui nous apparaît peu fiable et qui relaie des informations sans vérifications journalistiques, parfois erronées, comme une fausse rumeur sur un projet de taxe immobilière imputé à tort à Emmanuel Macron.",http://echelledejacob.blogspot.fr,2,Peu fiable,"Blog ou site perso, compte Twitter ou Facebook",Autre ou non déterminé,Autre site peu fiable ou douteux,Peu fiable autre
816059de-dabf-4af8-a037-78b897f3d00d,The Economist,"Un hebdomadaire et un site Internet britanniques. D'orientation libérale, le site défend le libre échange, la mondialisation, l'immigration et le libéralisme culturel. La majorité de ses ventes est réalisée à l'extérieur du Royaume-Uni.",http://economist.com,4,Plutôt fiable,Média étranger,Droite,Média étranger plutôt fiable,Plutôt fiable
b10d5dfb-683f-4623-9034-b58b325ccc7c,CNN,"CNN est un réseau américain de chaînes d'information et de sites Internet, qui appartient à CNN News Group et diffuse dans le monde entier via CNN International.",http://edition.cnn.com,4,Plutôt fiable,Média étranger,Autre ou non déterminé,Média étranger plutôt fiable,Plutôt fiable
2aa610ec-dfb9-4ef6-b4d7-78ad198937de,Edukactus,Un site satirique qui parodie l'actualité de l'éducation.,http://edukactus.wordpress.com,1,Parodique,Parodique,Autre ou non déterminé,Parodique ou divertissement plutôt fiable,Parodique
9002509d-7331-468d-856f-fe27e994c852,Egalité et Réconciliation,"Le site de la mouvance du militant « nationaliste révolutionnaire » Alain Soral, qui reprend de nombreux articles de sites peu fiables, dont de nombreuses fausses informations et théories conspirationnistes.",http://egaliteetreconciliation.fr,2,Peu fiable,Autre ou non déterminé,Conspirationniste,Conspirationniste peu fiable (hors média étranger),Peu fiable conspirationniste
4842bdae-f88c-4d4e-9efe-93e5fb4e9b66,El Manchar,Un site satirique algérien.,http://el-manchar.com,1,Parodique,Parodique,Autre ou non déterminé,Parodique ou divertissement plutôt fiable,Parodique
a82a22fd-c2ca-49ea-acc5-184f04ccb681,Electrosensible.info,"Un site internet militant réalisé par un internaute dénonçant l'influence négative des ondes et un complot supposé des lobbys et des médias contre les électrosensibles. Il relaie des informations généralement sourcées, en les présentant avec un parti pris assumé.",http://electrosensible.info,4,Plutôt fiable,Autre ou non déterminé,Autre ou non déterminé,Autre sites plutôt fiable,Plutôt fiable
6bd2b3f5-ee16-4b76-8aa4-5b7a1f45617b,Empire Herald,Un faux site d'information en anglais.,http://empireherald.com,1,Parodique,Parodique,Autre ou non déterminé,Parodique ou divertissement plutôt fiable,Parodique
b86b3e0e-29f2-4cd0-a163-65428c9a1db2,Empire News,Un faux site d'information en anglais.,http://empirenews.net,1,Parodique,Parodique,Autre ou non déterminé,Parodique ou divertissement plutôt fiable,Parodique
3a127d71-070e-4d8f-acef-9bcaa8730631,Empire Sports,Un site satirique américain.,http://empiresports.co,1,Parodique,Parodique,Autre ou non déterminé,Parodique ou divertissement plutôt fiable,Parodique
ccc6753b-69a6-4e93-a9b9-d4e876b10ce7,En Bref,Un site qui permet à n'importe quel internaute de créer un article fictif et de le partager sur les réseaux sociaux.,http://en-bref.fr,1,Parodique,Parodique,Autre ou non déterminé,Parodique ou divertissement plutôt fiable,Parodique
904a3ebf-f64d-4a94-aa79-6ee4cb41feda,ETF News,"Un site américain à l'origine de plusieurs fausses informations relayées de manière massive au cours de la dernière campagne présidentielle américaine. Il a par exemple relayé des fausses informations favorables à Donald Trump (entre autres exemples, une fausse affirmation selon laquelle le pape François aurait soutenu Donald Trump ou un autre article indiquant à tort que la fondatino Clinton aurait donné des millions de dollars au patron du FBI).",http://endingthefed.com,2,Peu fiable,Média étranger,Droite,Média étranger peu fiable ou douteux,Peu fiable droite ou extrême droite
d9708a7e-20a8-49c4-8f9a-4c628f2379e2,Enquête & Débat,Un site d'extrême droite lancé par Jean Robin qui publie des informations partiales sans toujours les sourcer et les vérifier.,http://enquete-debat.fr,3,Douteux,Autre ou non déterminé,Extrême-droite,"Site peu fiable ou douteux de droite, d’extrême droite ou pro-russe",Douteux
71496584-9637-4245-af69-ece5708bba42,Esprit Science Metaphysiques,"Un site qui nous apparaît peu fiable. Il prétend avoir une dimension scientifique mais relaie souvent des informations basée sur des pseudo-sciences, comme l'astrologie, ainsi que de fausses informations.",http://espritsciencemetaphysiques.com,2,Peu fiable,Autre ou non déterminé,Conspirationniste,Conspirationniste peu fiable (hors média étranger),Peu fiable conspirationniste
72854441-a1a0-4b78-aa9f-f516415aa0ff,L'Est républicain,Un quotidien et site Internet régional qui appartient au groupe EBRA.,http://estrepublicain.fr,4,Plutôt fiable,Média régional français,Autre ou non déterminé,Média régional français plutôt fiable,Plutôt fiable
608c6cf2-6f35-4407-b9f6-955dd6dde3b5,Etienne Chouard,"Le site d'Etienne Chouard, opposant en 2005 au Traité constitutionnel européen. Il diffuse des théories sur un prétendu « nouvel ordre mondial », sans preuve ni vérification.",http://etienne.chouard.free.fr,3,Douteux,"Blog ou site perso, compte Twitter ou Facebook",Autre ou non déterminé,Autre site peu fiable ou douteux,Douteux
39db3466-517d-4615-ab44-173e06a2d931,Eurocalifat,"Un site d'opinion, hostile à l'islam, qui publie parfois des informations trompeuses, par exemple du YouTubeur conspirationniste Paul Joseph Watson, ainsi que des articles insultants. Il a également publié une rumeur de suicide des époux Fillon début mars 2017, se contentant d'une vague mention ""ceci est une fiction. A moins que..."" en fin d'article.",http://eurocalifat.wordpress.com,2,Peu fiable,Autre ou non déterminé,Autre ou non déterminé,Autre site peu fiable ou douteux,Peu fiable autre
93959a48-fb59-4713-9390-4e0d3950438c,Europe Israël,"Un site qui se présente comme indépendant et soutenant l'Etat d'Israël, connu pour relayer des fausses informations, par exemple des affirmations erronées sur un pacte entre Emmanuel Macron et le « Canard Enchaîné » ou une fausse information sur des prétendus liens entre Emmanuel Macron et l'Arabie Saoudite.",http://europe-israel.org,2,Peu fiable,Média étranger,Autre ou non déterminé,Média étranger peu fiable ou douteux,Peu fiable autre
6f9847d7-379d-4837-b850-98b1a3b0fe95,Europe 1,"Radio généraliste privée, propriété du groupe Lagardère.",http://europe1.fr,4,Plutôt fiable,Média français,Autre ou non déterminé,Média français plutôt fiable,Plutôt fiable
f68dc0f3-1b24-4051-84a0-538d6c8e88b7,Facebook,"Facebook n'est pas une source d'information en soi, mais un réseau social avec plus d'un milliard d'utilisateurs, avec des informations pouvant à la fois émaner de médias « sérieux », de partis politiques et d'internautes plus ou moins fiables et plus ou moins bien intentionnés. L'information que vous y trouverez dépend donc fondamentalement de son émetteur.",http://facebook.com,4,Plutôt fiable,"Plateforme, forum, espace-tribune",Autre ou non déterminé,"Plateforme, forum, espace-tribune",Plutôt fiable
0f370571-6d01-4616-8ddc-cc0f1e00580b,Anonymous France,"Une page Facebook qui se présente comme émanant du mouvement Anonymous, ce qui n'est pas le cas. Elle diffuse des informations de sources variées, parfois peu fiables.",http://facebook.com/2017Anonymous,2,Peu fiable,"Blog ou site perso, compte Twitter ou Facebook",Autre ou non déterminé,Autre site peu fiable ou douteux,Peu fiable autre
f9497576-6368-41eb-861c-9bb405accc2d,Actu17,"Une page Facebook traitant de « terrorisme, police, sécurité ». Ce site agrège des informations de sources variables sous des titres souvent sensationnalistes, sans forcément les vérifier systématiquement.",http://facebook.com/Actu17,4,Plutôt fiable,"Blog ou site perso, compte Twitter ou Facebook",Autre ou non déterminé,Autre sites plutôt fiable,Plutôt fiable
e7cfca1e-fa13-4b7c-9a9d-7316b7ecc31e,Alex Jones,"Alex Jones est le créateur du site américain Infowars, qui diffuse régulièrement des théories conspirationnistes qui remettent en cause, sans preuve réelle, la « version officielle » des attentats du 11-Septembre ou affirment que les Nations unies voudraient répandre une maladie qui tuerait 80 % de la population mondiale. Comme le montre une enquête du « Washington Post », ses affirmations sans preuves rencontrent un certain écho chez Donald Trump.",http://facebook.com/AlexanderEmerickJones,2,Peu fiable,Média étranger,Extrême-droite,Média étranger peu fiable ou douteux,Peu fiable droite ou extrême droite
560f6739-c89e-4ae7-a429-e69631874e94,Business Insider France,"La version française de Business Insider, un site Web d'information consacré à l'information économique propriété du groupe allemand Axel Springer.",http://facebook.com/BusinessInsiderFrance,4,Plutôt fiable,Média français,Autre ou non déterminé,Média français plutôt fiable,Plutôt fiable
ead6aa7f-e45f-4b76-86c5-3574faf86e87,"France, ma patrie, ma nation",Une page Facebook partisan de Marine Le Pen qui relaie régulièrement de fausses informations et des photomontages grossiers.,http://facebook.com/France-ma-patrie-ma-nation-798326480197566,2,Peu fiable,"Blog ou site perso, compte Twitter ou Facebook",Extrême-droite,"Site peu fiable ou douteux de droite, d’extrême droite ou pro-russe",Peu fiable droite ou extrême droite
3b9d55a1-1ccf-4f23-89b2-ae088417f593,Vladimir Poutine - Fan Club -,"Une page Facebook prorusse qui relaie des informations de sources diverses, parfois erronées, par exemple un article mensonger sur Emmanuel Macron et l'Arabie Saoudite.",http://facebook.com/GlobalPublicPolicyAnalysis,2,Peu fiable,"Blog ou site perso, compte Twitter ou Facebook",Pro-russe,"Site peu fiable ou douteux de droite, d’extrême droite ou pro-russe",Peu fiable autre
de27e38e-5602-4863-8990-3d19324592d7,Je soutiens Vladimir Poutine,"Une page Facebook qui relaie des articles de sites peu fiables, sans vérification.",http://facebook.com/Je-soutiens-Vladimir-Poutine-677127992409179,2,Peu fiable,"Blog ou site perso, compte Twitter ou Facebook",Autre ou non déterminé,Autre site peu fiable ou douteux,Peu fiable autre
1d645b1c-68de-4d59-bfcd-51a7e3974de6,Je soutiens nos pompiers,"Une page Facebook présentée comme défendant les pompiers, mais qui relaie parfois de fausses informations et des messages de propagande d'extrême droite.",http://facebook.com/JeSoutiensNosPompiers,3,Douteux,"Blog ou site perso, compte Twitter ou Facebook",Extrême-droite,"Site peu fiable ou douteux de droite, d’extrême droite ou pro-russe",Douteux
9c0c6eb3-946a-400c-a3b1-c1c58118e850,Je t'aime Maman,"Une page Facebook qui relaie des informations de sites peu fiables, souvent sous des titres racoleurs.",http://facebook.com/jetaimemamann,2,Peu fiable,"Blog ou site perso, compte Twitter ou Facebook",Autre ou non déterminé,Autre site peu fiable ou douteux,Peu fiable autre
b3ff07e3-7401-4623-a0a5-e0849fb3e913,Je mange du porc et je t'emmerde,Une page Facebook d'extrême droite qui relaie parfois de fausses informations.,http://facebook.com/JMDPEJT,2,Peu fiable,"Blog ou site perso, compte Twitter ou Facebook",Autre ou non déterminé,Autre site peu fiable ou douteux,Peu fiable autre
2da7e117-7080-40b0-b442-011cdc429e6f,La Base d'un couple,"Une page Facebook qui agrège des informations de sources variables sous des titres souvent sensationnalistes, sans forcément les vérifier systématiquement.",http://facebook.com/Labaseduncouple,4,Plutôt fiable,"Blog ou site perso, compte Twitter ou Facebook",Autre ou non déterminé,Autre sites plutôt fiable,Plutôt fiable
008107e7-33b3-4ab6-9134-e1c39e05a928,On Aime La France,Une page Facebook identitaire qui relaie parfois de fausses informations.,http://facebook.com/LaFranceAvenir,2,Peu fiable,"Blog ou site perso, compte Twitter ou Facebook",Autre ou non déterminé,Autre site peu fiable ou douteux,Peu fiable autre
d4018bce-8bcf-4697-a3dc-26992af3e547,La France entre en Résistance,"Une page Facebook d'extrême droite qui relaie régulièrement de fausses informations, comme une vidéo qui affirmait montrer des violences dans un hôpital en France alors qu'elle avait été tournée en Russie.",http://facebook.com/LaFranceRentreEnResistance,2,Peu fiable,"Blog ou site perso, compte Twitter ou Facebook",Extrême-droite,"Site peu fiable ou douteux de droite, d’extrême droite ou pro-russe",Peu fiable droite ou extrême droite
cf15ca7e-a297-4bb9-99ad-9a77c48e61b8,La presse galactique,"Un site Internet qui diffuse des théories peu étayées sur les extraterrestres. Il a également diffusé à plusieurs reprises des informations erronées, notamment le fait qu'Edward Snowden aurait révélé l'existence d'aliens sous la Terre.",http://facebook.com/lapressegalactique,2,Peu fiable,Autre ou non déterminé,Conspirationniste,Conspirationniste peu fiable (hors média étranger),Peu fiable conspirationniste
bcda79aa-abc7-4d57-979a-98953aa95e3b,La révolte des vaches à lait,Une page Facebook qui diffuse régulièrement de fausses informations du site La Gauche m'a tuer.,http://facebook.com/Larevoltedesvachesalait,2,Peu fiable,"Blog ou site perso, compte Twitter ou Facebook",Autre ou non déterminé,Autre site peu fiable ou douteux,Peu fiable autre
e43ec965-b2a1-4258-990c-5913f3b2acac,"OUF, j'ai pas voté Hollande","Une page Facebook qui relaie parfois de fausses informations, par exemple un message affirmant à tort que François Hollande aurait été sifflé au Salon de l'agriculture 2017 (en reprenant, sans le préciser, une vidéo de l'année précédente).",http://facebook.com/laurencemw,3,Douteux,"Blog ou site perso, compte Twitter ou Facebook",Autre ou non déterminé,Autre site peu fiable ou douteux,Douteux
41ffa304-8a19-4f10-be9a-a90cb6802c62,L'oeil De La HONTE,"Une page Facebook d'extrême droite qui relaie de fausses informations, comme une rumeur attribuant à tort à Emmanuel Macron le projet de taxer les ""loyers fictifs"" des propriétaires.",http://facebook.com/Loeil-De-La-HONTE-431870643589953,2,Peu fiable,"Blog ou site perso, compte Twitter ou Facebook",Extrême-droite,"Site peu fiable ou douteux de droite, d’extrême droite ou pro-russe",Peu fiable droite ou extrême droite
