Id,Label,description,attr_home,Decodex,Fiabilité,Catégorie,Orientation contenu,Synthèse,Fiabilité et orientation
32ea0280-8498-4cb7-8453-d68a2fa4da3f,Hors de vos pensés,"Un site peu fiable qui reprend régulièrement de fausses informations, comme une intox sur Emmanuel Macron qui refuserait de serrer les mains des « pauvres » ou un canular qui voulait faire croire qu'Emmanuel Macron voudrait supprimer les allocations familiales.",http://horsdevospenses0833.blogspot.fr,2,Peu fiable,Autre ou non déterminé,Autre ou non déterminé,Autre site peu fiable ou douteux,Peu fiable autre
f8a404bb-3d5c-4e19-a241-ec0ac3ca86f5,Hors de vos pensées,Un site qui diffuse des articles qui peuvent induire le lecteur en erreur et des théories conspirationnistes.,http://horsdevospenses12333.blogspot.fr,2,Peu fiable,Autre ou non déterminé,Conspirationniste,Conspirationniste peu fiable (hors média étranger),Peu fiable conspirationniste
a6379329-10db-4539-846d-68fba32465c2,Huffington Post,"Un site Web d'information et de divertissement lancé aux Etats-Unis et décliné dans plusieurs pays. Le site est en grande partie alimenté par les articles de la rédaction. A différencier des tribunes et billets de blogs, identifiés sous l'étiquette « Les Blogs », en haut de la page. Les informations que vous trouverez dans ces articles relaient des opinions variées (politiques, experts...) et ont une connotation plus subjective qu'un article journalistique.",http://huffingtonpost.fr,4,Plutôt fiable,Média étranger,Autre ou non déterminé,Média étranger plutôt fiable,Plutôt fiable
3a62aec9-2f8c-401a-9664-53374da509bd,L'Humanité,"Un quotidien d'information généraliste, ancien organe central du Parti communiste français, classé politiquement à la gauche de la gauche.",http://humanite.fr,4,Plutôt fiable,Média français,Extrême-gauche,Média français plutôt fiable,Plutôt fiable
0501602f-37e4-40c5-93f2-146925072575,L'humour de droite,"Une page Facebook au ton humoristique qui se moque régulièrement de la droite et de l'extrême droite, notamment via de nombreux détournements sur les réseaux sociaux.",http://humourdedroite.tumblr.com,1,Parodique,Parodique,Gauche ou centre-gauche,Parodique ou divertissement plutôt fiable,Parodique
889dd28a-ae3a-483a-a902-f31057ce3b43,Humour de mecs,"Un site Internet racoleur spécialisé dans les contenus « insolites ». Ce site agrège des informations de sources variables sous des titres souvent sensationnalistes, sans forcément les vérifier systématiquement.",http://humourdemecs.com,4,Plutôt fiable,Divertissement ou hobby,Autre ou non déterminé,Parodique ou divertissement plutôt fiable,Plutôt fiable
735dec6f-3578-4ab5-9b26-8a5189038868,Huzlers,Un faux site d'information en anglais.,http://huzlers.com,1,Parodique,Parodique,Autre ou non déterminé,Parodique ou divertissement plutôt fiable,Parodique
adf87fd2-d890-4f47-bfd6-da57b357fc92,Hypotheses,Une plateforme de blogs dans tous les domaines des sciences humaines et sociale destinée aux spécialistes et au grand public.,http://hypotheses.org,4,Plutôt fiable,"Plateforme, forum, espace-tribune",Autre ou non déterminé,"Plateforme, forum, espace-tribune",Plutôt fiable
d43c37dd-6cd7-4717-84d8-642b9e7490d5,i24 News,"Chaîne de télévision israélienne d'information en continu, diffusée à l'international. Elle fait partie du groupe Altice, propriété du milliardaire Patrick Drahi. Objectif revendiqué en 2012 par ce dernier : « Montrer le vrai visage d'Israël au monde, sans être un instrument de propagande. » Dans les faits, certains observateurs jugent la ligne de la chaîne plutôt déséquilibrée en faveur d'Israël.",http://i24news.tv,4,Plutôt fiable,Média étranger,Autre ou non déterminé,Média étranger plutôt fiable,Plutôt fiable
1d2df892-6c80-4609-b6a6-4c9b7db8eee2,International Business Times,"Journal économique américain publié en anglais, chinois, japonais et italien.",http://ibtimes.com,4,Plutôt fiable,Média étranger,Autre ou non déterminé,Média étranger plutôt fiable,Plutôt fiable
556f8f61-ccf7-43d3-a421-1797fca7c500,IlFattoQuotidiano.fr,"Un site Internet qui reprend de nombreuses théories conspirationnistes, comme celle de l'Italien Giulietto Chiesa. A ne pas confondre avec le quotidien italien du même nom.",http://ilfattoquotidiano.fr,2,Peu fiable,Autre ou non déterminé,Conspirationniste,Conspirationniste peu fiable (hors média étranger),Peu fiable conspirationniste
fd4835af-64d4-479b-b1d0-15cd0120e66e,Illuminati News,"Un site américain qui diffuse des théories conspirationnistes, notamment sur les Illuminati ou les extraterrestres.",http://illuminati-news.com,2,Peu fiable,Média étranger,Conspirationniste,Média étranger peu fiable ou douteux,Peu fiable conspirationniste
ec6e5553-3ad3-4ac7-9fc1-4a626a636adb,Illuminati Watcher,"Un site qui diffuse, comme son nom l'indique, des théories sur un prétendu complot illuminati.",http://illuminatiwatcher.com,2,Peu fiable,Autre ou non déterminé,Conspirationniste,Conspirationniste peu fiable (hors média étranger),Peu fiable conspirationniste
0270ca33-2eba-4dd1-9268-3744ab1e7872,The Independent,"Un des principaux quotidiens britanniques, transformé en journal 100 % en ligne début 2016. Il a été racheté en mars 2010 par Alexander Lebedev, un homme d'affaires russe.",http://independent.co.uk,4,Plutôt fiable,Média étranger,Autre ou non déterminé,Média étranger plutôt fiable,Plutôt fiable
8cbc1a37-683e-476c-a2d2-d8f09a06450d,Info Contre Info,Un site qui nous apparaît peu fiable et qui héberge des théories parfois conspirationnistes et antisémites.,http://info-contre-info.fr,2,Peu fiable,Autre ou non déterminé,Conspirationniste,Conspirationniste peu fiable (hors média étranger),Peu fiable conspirationniste
5434b3f1-1f9d-44ad-a38c-9765471f66fc,Info 24,"Un site qui reprend des informations de sources diverses et reprend régulièrement des rumeurs sans les vérifier. Il relaie parfois de fausses informations, comme lorsqu'il accuse Emmanuel Macron d'être allié avec un islamiste radical sur la base de propos manipulés.",http://info24.fr,3,Douteux,Média français,Autre ou non déterminé,Autre site peu fiable ou douteux,Douteux
b56b7b16-0f6d-4f5a-8af1-29266e9579e9,Info Chrétienne,Un site chrétien et spirituel qui reprend des informations sans toujours les vérifier et renvoie parfois vers des sources non fiables.,http://infochretienne.com,3,Douteux,Autre ou non déterminé,Autre ou non déterminé,Autre site peu fiable ou douteux,Douteux
a1374d90-f6a6-4826-abf2-e1c1ff648328,Info et Secret,"Un blog qui agrège des informations de sources variables sous des titres souvent sensationnalistes, sans forcément les vérifier systématiquement. Il reprend également des théories sur les OVNIS et des écrits d'auteurs conspirationnistes comme le journaliste américain Paul Craig Roberts (qui accuse notamment le gouvernement américain d’être responsable de l’attentat contre « Charlie Hebdo »).",http://infoetsecret.com,3,Douteux,"Blog ou site perso, compte Twitter ou Facebook",Autre ou non déterminé,Autre site peu fiable ou douteux,Douteux
2a7a15f5-092e-4758-a83d-f9dc75644edd,Informaction.info,"Un site qui nous apparaît peu fiable et qui diffuse parfois des fausses informations. Il reprend notamment des vidéos de Pierre Jovanovic, une des figures de la mouvance conspirationniste en France, ou encore du Cercle des volontaires.",http://informaction.info,2,Peu fiable,Autre ou non déterminé,Conspirationniste,Conspirationniste peu fiable (hors média étranger),Peu fiable conspirationniste
56d3add4-7b93-48c7-ac1d-484d9a160048,Information Liberation,"Un site américain orienté, partisan de Vladimir Poutine et de Donald Trump, qui relaie régulièrement des informations biaisées voire erronées.",http://informationliberation.com,2,Peu fiable,Autre ou non déterminé,Droite,"Site peu fiable ou douteux de droite, d’extrême droite ou pro-russe",Peu fiable droite ou extrême droite
47da6232-c952-4c6f-93c2-c23240e2d75b,Informations en direct France,Un site présenté comme traitant l'actualité traditionnelle mais qui diffuse des articles qui peuvent induire le lecteur en erreur et des théories conspirationnistes.,http://informations-en-direct-france.com,2,Peu fiable,Média français,Conspirationniste,Conspirationniste peu fiable (hors média étranger),Peu fiable conspirationniste
65c3edac-f9f9-4337-b3b2-b78647a7f7f6,Infos Bordeaux,"Un site présenté comme un média d'information local neutre, mais orienté à l'extrême droite et qui publie régulièrement de fausses informations.",http://infos-bordeaux.fr,2,Peu fiable,Média régional français,Extrême-droite,"Site peu fiable ou douteux de droite, d’extrême droite ou pro-russe",Peu fiable droite ou extrême droite
5c3fb66e-5a36-461b-8e32-0704167036ed,Infos Toulouse,"Un site présenté comme un média d'information local neutre, mais orienté à l'extrême droite et qui publie régulièrement de fausses informations.",http://infos-toulouse.fr,2,Peu fiable,Média régional français,Extrême-droite,"Site peu fiable ou douteux de droite, d’extrême droite ou pro-russe",Peu fiable droite ou extrême droite
b1bd26a9-ab61-47ee-9a65-a18accafabf6,Infowars,"Un site créé par un animateur américain, Alex Jones. Il diffuse régulièrement des théories conspirationnistes qui remettent en cause, sans preuve réelle, la « version officielle » des attentats du 11-Septembre ou affirment que les Nations unies voudraient répandre une maladie qui tuerait 80 % de la population mondiale. Comme le montre une enquête du « Washington Post », ses affirmations sans preuves rencontrent un certain écho chez Donald Trump.",http://infowars.com,2,Peu fiable,Média étranger,Conspirationniste,Média étranger peu fiable ou douteux,Peu fiable conspirationniste
12afcd7d-74ff-488a-b4ae-734c4032db82,Instagram,"Instagram n'est pas une source d'information en soi, mais un réseau social avec des millions d'utilisateurs. Les informations peuvent à la fois émaner de médias « sérieux », de partis politiques mais aussi d'internautes plus ou moins fiables et plus ou moins bien intentionnés. L'information que vous y trouverez dépend donc fondamentalement de son émetteur.",http://instagram.com,4,Plutôt fiable,"Plateforme, forum, espace-tribune",Autre ou non déterminé,"Plateforme, forum, espace-tribune",Plutôt fiable
391b51f4-6929-46ea-939f-b3c26fe48df6,Investigaction,"Un site internet créé par Michel Collon, militant anti-américain et antisioniste, proche de Thierry Meyssan, connu pour reprendre régulièrement des thèses conspirationnistes, sur le 11-Septembre ou la Syrie.",http://investigaction.net,2,Peu fiable,Autre ou non déterminé,Conspirationniste,Conspirationniste peu fiable (hors média étranger),Peu fiable conspirationniste
ea758f8e-84c3-4b69-a260-16a5e6bbda90,Institut pour la protection de la santé naturelle,"Le site de l'Institut pour la protection de la santé naturelle, qui milite pour la « médecine naturelle », c'est-à-dire l'utilisation des plantes médicinales plutôt que des médicaments et des vaccins. L’IPSN est financé par des dons, des conférences et des partenariats (avec une société d’édition, l’Ecole lyonnaise des plantes médicinales, et des PME d’herboristes). Il compte dans son comité scientifique le professeur Henri Joyeux, radié de l'ordre des médecins en 2016, notamment pour « des manquements d’une extrême gravité au code de déontologie », et qui met notamment en avant des théories conspirationnistes anti-vaccins.",http://ipsn.eu,3,Douteux,Site Santé,Autre ou non déterminé,Autre site peu fiable ou douteux,Douteux
5346c98f-765b-4dc0-babd-7e0ac6369b31,Islamisme.fr,Un site aux relents islamophobes qui diffuse régulièrement de fausses informations.,http://islamisme.fr,2,Peu fiable,Autre ou non déterminé,Extrême-droite,"Site peu fiable ou douteux de droite, d’extrême droite ou pro-russe",Peu fiable droite ou extrême droite
89a1b57d-1898-490b-85e2-98d58f570c0d,Itaglive,Un site satirique américain.,http://itaglive.com,1,Parodique,Parodique,Autre ou non déterminé,Parodique ou divertissement plutôt fiable,Parodique
4f540850-0c42-4625-a5ab-78c66f0b763c,iTélé,"Chaîne de télévision d'information en continu qui appartient au groupe Canal+. Le groupe est une filiale du groupe Vivendi, dirigé par le milliardaire Vincent Bolloré.",http://itele.fr,4,Plutôt fiable,Média français,Autre ou non déterminé,Média français plutôt fiable,Plutôt fiable
9a0cea22-5c8f-4df7-8c1c-39b49a2233ea,IVG.net,"Un site anti-avortement qui est présenté comme un centre d'écoute et d'information sur l'interruption volontaire de grossesse (IVG), sans que son parti pris n'apparaisse clairement. Supposé assurer un service d’écoute et d’aide pour les femmes s’interrogeant sur une interruption de grossesse, ce numéro est en réalité celui d’une association dirigée par un couple de catholiques militant contre l'avortement.",http://ivg.net,2,Peu fiable,Site Santé,Autre ou non déterminé,Autre site peu fiable ou douteux,Peu fiable autre
3589d2d5-0ef4-4f35-96c7-f7ad8c9c1553,"Je suis stupide, j'ai voté Hollande",Un site anti-Hollande qui diffuse régulièrement de fausses informations.,http://je-suis-stupide-j-ai-vote-hollande.fr,2,Peu fiable,Autre ou non déterminé,Autre ou non déterminé,Autre site peu fiable ou douteux,Peu fiable autre
c2234a3e-f981-4d48-a833-5e1cd19f45c6,Jean-Marc Morandini,"Un site internet dédié à l'actualité médiatique créé par le journaliste controversé Jean-Marc Morandini. Condamné pour plagiat en 2012 pour des reprises « intensives » du site du « Point », le site reprend de nombreuses rumeurs sans les vérifier. A prendre avec des pincettes.",http://jeanmarcmorandini.com,3,Douteux,"Blog ou site perso, compte Twitter ou Facebook",Autre ou non déterminé,Autre site peu fiable ou douteux,Douteux
165f19db-b2a6-41bb-80b4-16d4ff71a4dd,Jean-Paul Ney,"Jean-Paul Ney est un journaliste controversé, connu pour publier des informations sans forcément les vérifier systématiquement. Il a notamment été condamné par le tribunal correctionnel de Paris pour « recel de violation du secret de l'enquête » après avoir diffusé le 7 janvier 2015 l'identité des frères Kouachi après l'attentat contre « Charlie Hebdo ». Le procureur de la République de Paris, François Molins, avait entre autres estimé que cette publication avait ruiné « tout espoir de surprise » dans la traque des deux terroristes. Jean-Paul Ney a également diffusé en mars 2016 sur les réseaux sociaux les coordonnées d'un homme, le présentant à tort comme auteur des attentats de Bruxelles.",http://jeanpaulney.com,2,Peu fiable,"Blog ou site perso, compte Twitter ou Facebook",Autre ou non déterminé,Autre site peu fiable ou douteux,Peu fiable autre
32b71fa2-3e86-4887-bf46-da47811a9c62,Jeune Nation,Le site d'un mouvement nationaliste radical.,http://jeune-nation.com,2,Peu fiable,Autre ou non déterminé,Autre ou non déterminé,Autre site peu fiable ou douteux,Peu fiable autre
38344fb6-bfc3-4514-8201-a862fa59ec21,Jeuxvideo.com,"Un site consacré à l'actualité du monde du jeu vidéo, qui publie principalement des actualités sur les jeux qui vont sortir et des tests. Il appartient actuellement au groupe Webedia. A ne pas confondre avec les forums qu'il héberge, alimentés eux par les utilisateurs.",http://jeuxvideo.com,4,Plutôt fiable,Divertissement ou hobby,Autre ou non déterminé,Parodique ou divertissement plutôt fiable,Plutôt fiable
aeeb01b9-b3bd-4e5f-8b3a-fece5c165fad,Les Forums de JeuxVideo.com,"Les forums du site JeuxVideo.com font partie des plus actifs en France, notamment par les adolescents. On y trouve des millions de fils de discussion, sur tous types de sujets (et pas seulement les jeux vidéo). Parmi les sections les plus actives du forum, on trouve l'emblématique « Blablas 18-25 ans », surnommé le « 18-25 », réservoir de mauvaises blagues et polémiques. Ses forums ont notamment été critiqués à plusieurs reprises pour des propos racistes, homophobes et sexistes.",http://jeuxvideo.com/forums,4,Plutôt fiable,"Plateforme, forum, espace-tribune",Autre ou non déterminé,"Plateforme, forum, espace-tribune",Plutôt fiable
ac86c934-01e7-4f98-96a5-3526ce2b0931,Le Journal de la Haute-Marne,Un quotidien et site Internet régional.,http://jhm.fr,4,Plutôt fiable,Média régional français,Autre ou non déterminé,Média régional français plutôt fiable,Plutôt fiable
f7047a10-c356-4589-ac86-ec51bcfd6baf,Le journal des femmes,"Un site féminin français, qui parle de mode, beauté, cuisine, etc. Il est édité par CCM Benchmark Group, racheté par « Le Figaro » en 2015.",http://journaldesfemmes.com,4,Plutôt fiable,Média français,Autre ou non déterminé,Média français plutôt fiable,Plutôt fiable
f36a9ef6-bfb6-4434-94be-acd392d11e9f,Jovanovic,"Le blog de Pierre Jovanovic, une des figures de la mouvance conspirationniste.",http://jovanovic.com,2,Peu fiable,"Blog ou site perso, compte Twitter ou Facebook",Conspirationniste,Conspirationniste peu fiable (hors média étranger),Peu fiable conspirationniste
83a303f6-c603-43af-95ff-4ff6c986c04c,JP Petit,"Jean-Pierre Petit, ancien chercheur au CNRS, adepte de l'ufologie et de nombreuses théories du complot, notamment sur le tsunami de 2004 en Indonésie ou le 11-Septembre. A ne pas confondre avec l'économiste du même nom.",http://jp-petit.org,2,Peu fiable,"Blog ou site perso, compte Twitter ou Facebook",Conspirationniste,Conspirationniste peu fiable (hors média étranger),Peu fiable conspirationniste
017a45e0-0742-4622-8a1d-b81e75a63328,JSS News,Un site pro-israélien qui défend des thèses opposées à un Etat palestinien et favorables à la colonisation. Il a plusieurs fois diffusé des informations non sourcées et approximatives.,http://jssnews.com,3,Douteux,Autre ou non déterminé,Autre ou non déterminé,Autre site peu fiable ou douteux,Douteux
ff9d5801-92d9-426c-8e15-88860b40eacb,Konbini,"Un site d'information et de divertissement français. Le site publie ses propres informations, mais reprend parfois des informations approximatives ou fausses venant d'autres sites.",http://konbini.com,4,Plutôt fiable,Divertissement ou hobby,Autre ou non déterminé,Parodique ou divertissement plutôt fiable,Plutôt fiable
51fd8822-eecf-4c30-b63e-60dbd8896bd0,Kontre Kulture,"Une entreprise fondée par Alain Soral qui publie des auteurs de la mouvance d'Egalité et Réconciliation, dont certains ouvrages antisémites.",http://kontrekulture.com,2,Peu fiable,Autre ou non déterminé,Extrême-droite,"Site peu fiable ou douteux de droite, d’extrême droite ou pro-russe",Peu fiable droite ou extrême droite
3cff6574-3564-4dc5-8415-8e69c8a98757,Korben,"Manuel Dorne est un blogueur qui écrit sous le pseudonyme Korben. Il s'intéresse principalement aux questions liées à l'informatique, à la vie numérique et à la culture geek.",http://korben.info,4,Plutôt fiable,"Blog ou site perso, compte Twitter ou Facebook",Autre ou non déterminé,Autre sites plutôt fiable,Plutôt fiable
f9298fca-9943-49cc-a4f0-dd871451c90c,L'Echo,Un quotidien et site Internet régional français.,http://l-echo.info,4,Plutôt fiable,Média régional français,Autre ou non déterminé,Média régional français plutôt fiable,Plutôt fiable
c7c196bd-3483-4cb0-a5a2-a114f81234de,La Chronique Agora,"Le site La Chronique Agora reprend des articles de la lettre d’information financière et d’investissements du même nom, créée en 1997. Cette notice avait précédemment référencé pendant plusieurs semaines ce site comme peu fiable et diffusant des théories conspirationnistes, et ce par erreur, à la suite d’une regrettable confusion entre deux sites. Le Monde a donc supprimé cette appréciation dénigrante et présente ses excuses aux lecteurs de la Chronique Agora.",http://la-chronique-agora.com,4,Plutôt fiable,Média français,Autre ou non déterminé,Média français plutôt fiable,Plutôt fiable
016896f6-9329-4db3-939f-988c0f2b1afd,La Croix,Un quotidien et site Internet catholique d'information généraliste qui appartient à Bayard Presse.,http://la-croix.com,4,Plutôt fiable,Média français,Autre ou non déterminé,Média français plutôt fiable,Plutôt fiable
558a2675-8063-48b2-811b-98904a67d802,La Deche du Midi,Un site satirique qui se moque de la presse locale.,http://ladechedumidi.com,1,Parodique,Parodique,Autre ou non déterminé,Parodique ou divertissement plutôt fiable,Parodique
7d8eab69-95e6-4a12-a891-a43ee4f0de43,La Dépêche du Midi,Un quotidien et site Internet régional qui appartient au groupe La Dépêche.,http://ladepeche.fr,4,Plutôt fiable,Média régional français,Autre ou non déterminé,Média régional français plutôt fiable,Plutôt fiable
843cac5f-5c1a-45df-a77d-f51481550582,La gauche m'a tuer,"Un site d'opinion proche de l'extrême droite créé par Mike Borowski, ancien collaborateur du député Christian Vanneste. Il revendique le fait de ne pas faire de l'information mais de donner son opinion. Le site publie régulièrement de fausses informations, par exemple sur un projet de mosquée à Tulle en 2015, et des informations déformées et exagérées sous des titres chocs.",http://lagauchematuer.fr,2,Peu fiable,Autre ou non déterminé,Extrême-droite,"Site peu fiable ou douteux de droite, d’extrême droite ou pro-russe",Peu fiable droite ou extrême droite
90d3019f-e662-4b99-bc15-b88f52c4f71b,La Horde,"Un site d'extrême gauche et anti extrême droite, dont les contenus proviennent souvent de militants sans être vérifiés.",http://lahorde.samizdat.net,4,Plutôt fiable,Autre ou non déterminé,Extrême-gauche,Autre sites plutôt fiable,Plutôt fiable
aac30bd5-8594-45b0-8ed1-fbf3718fccd2,L'Alsace-Le Pays,Un quotidien et site Internet régional qui appartient au groupe BFCM.,http://lalsace.fr,4,Plutôt fiable,Média régional français,Autre ou non déterminé,Média régional français plutôt fiable,Plutôt fiable
9c259c63-2785-4b5f-9542-2d5e6810f036,La Marseillaise,"Un quotidien et site Internet marseillais, historiquement marqué à gauche.",http://lamarseillaise.fr,4,Plutôt fiable,Média régional français,Autre ou non déterminé,Média régional français plutôt fiable,Plutôt fiable
827c8541-c0d4-43bd-b295-d35e70a28fb0,La mine d'infos,Un site Internet qui reprend des articles sur des sujets divers dont de fausses informations émanant de sites peu fiables.,http://laminedinfos.fr,2,Peu fiable,Autre ou non déterminé,Autre ou non déterminé,Autre site peu fiable ou douteux,Peu fiable autre
e8bb107d-d9e3-4d5a-b99f-67ada124fd22,La Montagne,Un quotidien et site Internet régional installé à Clermont-Ferrand et qui appartient au groupe Centre-France.,http://lamontagne.fr,4,Plutôt fiable,Média régional français,Autre ou non déterminé,Média régional français plutôt fiable,Plutôt fiable
085ac532-4838-4159-9369-0f669f82f584,La Nouvelle République du Centre-Ouest,Un quotidien et site Internet régional qui appartiennent au Groupe NRCO.,http://lanouvellerepublique.fr,4,Plutôt fiable,Média régional français,Autre ou non déterminé,Média régional français plutôt fiable,Plutôt fiable
8996dcbf-bde7-445e-a8eb-b9fe6f22f775,La Nutrition,"Un site animé par le journaliste scientifique Thierry Souccar, qui publie également des ouvrages avec la maison d'édition portant son nom. Le site Internet prend position contre la vaccination avec des arguments contestés par la communauté scientifique. Le site relaie les thèses d'Henri Joyeux, chef de file des « anti-vaccination », radié de l'ordre des médecins en 2016, notamment pour « des manquements d'une extrême gravité au code de déontologie ».",http://lanutrition.fr,3,Douteux,Autre ou non déterminé,Autre ou non déterminé,Autre site peu fiable ou douteux,Douteux
b07092e8-10cc-4581-8202-462d63f06162,La Presse de la Manche,Un quotidien et site Internet régional qui appartiennent au groupe SIPA - Ouest-France.,http://lapressedelamanche.fr,4,Plutôt fiable,Média régional français,Autre ou non déterminé,Média régional français plutôt fiable,Plutôt fiable
bc0473bc-d8c6-4203-959c-27e037e4c5f8,La Presse galactique,Un site qui nous apparaît peu fiable et qui héberge parfois des fausses informations.,http://lapressegalactique.com,2,Peu fiable,Autre ou non déterminé,Autre ou non déterminé,Autre site peu fiable ou douteux,Peu fiable autre
fa1dfd3e-c96d-4f23-a936-49cbcbefb023,La Provence,Un quotidien et site Internet régional qui appartiennent à Bernard Tapie.,http://laprovence.com,4,Plutôt fiable,Média régional français,Autre ou non déterminé,Média régional français plutôt fiable,Plutôt fiable
839ec5e9-6fb0-4b8f-9470-dfbf41f16cd4,La République du Centre,"Un quotidien et site Internet régional du Loiret, qui appartient au groupe Centre-France.",http://larep.fr,4,Plutôt fiable,Média régional français,Autre ou non déterminé,Média régional français plutôt fiable,Plutôt fiable
05d14997-46ef-4d91-8299-fb9cc347e064,La République des Pyrénées,Un quotidien et site Internet régional.,http://larepubliquedespyrenees.fr,4,Plutôt fiable,Média régional français,Autre ou non déterminé,Média régional français plutôt fiable,Plutôt fiable
9cabb877-7dcc-4547-a0eb-512a13d3dd94,La Sardine du Port,Un site parodique à prendre au second degré.,http://lasardineduport.fr,1,Parodique,Parodique,Autre ou non déterminé,Parodique ou divertissement plutôt fiable,Parodique
f534fcf1-66dc-47af-b89b-88a64ec0c1a6,Los Angeles Times,Un quotidien et site Internet américain centrés sur l'actualité de Los Angeles et de la Californie.,http://latimes.com,4,Plutôt fiable,Média étranger,Autre ou non déterminé,Média étranger plutôt fiable,Plutôt fiable
